### ISSUE TITLE
请问导流量时一直停在三次握手的阶段，导不过来数据包该怎么解决？

### ISSUE THREAD

**Issue by ljp215** [session-replay-tools/tcpcopy#152]
您好：
我使用的是0.9.5也就是截止到今天最新的版本，日志error_intercept.log的部分如下：
2013/10/14 16:56:56 +521 [debug] add client router:2359
2013/10/14 16:56:56 +521 [debug] add client router:31990
2013/10/14 16:56:56 +522 [debug] add client router:2373
2013/10/14 16:56:56 +525 [debug] add client router:5835
2013/10/14 16:56:56 +529 [debug] add client router:32022
2013/10/14 16:56:56 +533 [debug] add client router:50384
2013/10/14 16:56:56 +534 [debug] add client router:18412
2013/10/14 16:56:56 +535 [debug] add client router:32051
2013/10/14 16:56:56 +538 [debug] add client router:50402
2013/10/14 16:56:56 +543 [debug] add client router:32070
2013/10/14 16:56:56 +549 [debug] add client router:18460
2013/10/14 16:56:56 +549 [debug] add client router:50450
2013/10/14 16:56:56 +551 [debug] add client router:18470
2013/10/14 16:56:56 +553 [debug] add client router:32130
2013/10/14 16:56:56 +555 [debug] add client router:12667
2013/10/14 16:56:56 +556 [debug] add client router:12670
2013/10/14 16:56:56 +571 [debug] add client router:30996
2013/10/14 16:56:56 +571 [debug] add client router:5967
2013/10/14 16:56:56 +571 [debug] add client router:50536
2013/10/14 16:56:56 +571 [debug] add client router:31002
2013/10/14 16:56:56 +571 [debug] add client router:12737
2013/10/14 16:56:56 +586 [debug] add client router:50573
2013/10/14 16:56:56 +586 [debug] add client router:32232
2013/10/14 16:56:56 +586 [debug] add client router:32236
2013/10/14 16:56:56 +586 [debug] add client router:18552
2013/10/14 16:56:56 +586 [debug] add client router:12768
2013/10/14 16:56:56 +592 [debug] add client router:18609
2013/10/14 16:56:56 +596 [debug] add client router:12833
2013/10/14 16:56:56 +599 [debug] add client router:18625

tcpdump的抓包情况如下：
17:09:32.634745 IP 10.0.11.34.1293 > 10.0.31.139.8081: Flags [S], seq 344201018, win 14600, options [mss 1460,nop,nop,sackOK,nop,wscale 7], length 0
17:09:32.634885 IP 10.0.11.34.1293 > 10.0.31.139.8081: Flags [R], seq 344201019, win 0, length 0
17:09:32.639241 IP 10.0.11.47.29401 > 10.0.31.139.8081: Flags [S], seq 1292087775, win 14600, options [mss 1460,nop,nop,sackOK,nop,wscale 7], length 0
17:09:32.639348 IP 10.0.11.47.29401 > 10.0.31.139.8081: Flags [R], seq 1292087776, win 0, length 0
17:09:32.639692 IP 10.0.11.45.40907 > 10.0.31.139.8081: Flags [S], seq 1478171253, win 14600, options [mss 1460,nop,nop,sackOK,nop,wscale 7], length 0
17:09:32.639849 IP 10.0.11.45.40907 > 10.0.31.139.8081: Flags [R], seq 1478171254, win 0, length 0
17:09:32.658314 IP 10.0.11.40.1152 > 10.0.31.139.8081: Flags [S], seq 659092991, win 14600, options [mss 1460,nop,nop,sackOK,nop,wscale 7], length 0
17:09:32.658314 IP 10.0.11.34.1420 > 10.0.31.139.8081: Flags [S], seq 973485791, win 14600, options [mss 1460,nop,nop,sackOK,nop,wscale 7], length 0
17:09:32.658314 IP 10.0.11.34.1420 > 10.0.31.139.8081: Flags [R], seq 973485792, win 0, length 0
17:09:32.658314 IP 10.0.11.40.1152 > 10.0.31.139.8081: Flags [R], seq 659092992, win 0, length 0
17:09:32.668480 IP 10.0.11.47.29513 > 10.0.31.139.8081: Flags [S], seq 1129125119, win 14600, options [mss 1460,nop,nop,sackOK,nop,wscale 7], length 0
17:09:32.668480 IP 10.0.11.47.29513 > 10.0.31.139.8081: Flags [R], seq 1129125120, win 0, length 0
17:09:32.669218 IP 10.0.11.34.1492 > 10.0.31.139.8081: Flags [S], seq 1275238996, win 14600, options [mss 1460,nop,nop,sackOK,nop,wscale 7], length 0
17:09:32.669756 IP 10.0.11.34.1492 > 10.0.31.139.8081: Flags [R], seq 1275238997, win 0, length 0
17:09:32.675648 IP 10.0.11.41.34062 > 10.0.31.139.8081: Flags [S], seq 474902438, win 14600, options [mss 1460,nop,nop,sackOK,nop,wscale 7], length 0
17:09:32.675922 IP 10.0.11.41.34062 > 10.0.31.139.8081: Flags [R], seq 474902439, win 0, length 0
17:09:32.676366 IP 10.0.11.41.34073 > 10.0.31.139.8081: Flags [S], seq 1136707891, win 14600, options [mss 1460,nop,nop,sackOK,nop,wscale 7], length 0
17:09:32.676366 IP 10.0.11.41.34073 > 10.0.31.139.8081: Flags [R], seq 1136707892, win 0, length 0
17:09:32.678212 IP 10.0.11.46.57820 > 10.0.31.139.8081: Flags [S], seq 1820794365, win 14600, options [mss 1460,nop,nop,sackOK,nop,wscale 7], length 0
17:09:32.678212 IP 10.0.11.46.57820 > 10.0.31.139.8081: Flags [R], seq 1820794366, win 0, length 0
17:09:32.679856 IP 10.0.11.47.29543 > 10.0.31.139.8081: Flags [S], seq 3403470062, win 14600, options [mss 1460,nop,nop,sackOK,nop,wscale 7], length 0
17:09:32.679973 IP 10.0.11.47.29543 > 10.0.31.139.8081: Flags [R], seq 3403470063, win 0, length 0
17:09:32.682567 IP 10.0.11.40.1276 > 10.0.31.139.8081: Flags [S], seq 3092519955, win 14600, options [mss 1460,nop,nop,sackOK,nop,wscale 7], length 0
17:09:32.683327 IP 10.0.11.40.1276 > 10.0.31.139.8081: Flags [R], seq 3092519956, win 0, length 0
17:09:32.685358 IP 10.0.11.41.34113 > 10.0.31.139.8081: Flags [S], seq 2152689675, win 14600, options [mss 1460,nop,nop,sackOK,nop,wscale 7], length 0
17:09:32.685358 IP 10.0.11.41.34113 > 10.0.31.139.8081: Flags [R], seq 2152689676, win 0, length 0
17:09:32.685358 IP 10.0.11.40.1296 > 10.0.31.139.8081: Flags [S], seq 3425750253, win 14600, options [mss 1460,nop,nop,sackOK,nop,wscale 7], length 0
17:09:32.686320 IP 10.0.11.40.1296 > 10.0.31.139.8081: Flags [R], seq 3425750254, win 0, length 0
17:09:32.686320 IP 10.0.11.32.20127 > 10.0.31.139.8081: Flags [S], seq 3580197746, win 14600, options [mss 1460,nop,nop,sackOK,nop,wscale 7], length 0
17:09:32.686320 IP 10.0.11.32.20127 > 10.0.31.139.8081: Flags [R], seq 3580197747, win 0, length 0
17:09:32.690932 IP 10.0.11.41.34140 > 10.0.31.139.8081: Flags [S], seq 2356043568, win 14600, options [mss 1460,nop,nop,sackOK,nop,wscale 7], length 0
17:09:32.692146 IP 10.0.11.41.34140 > 10.0.31.139.8081: Flags [R], seq 2356043569, win 0, length 0
17:09:32.693586 IP 10.0.11.46.57874 > 10.0.31.139.8081: Flags [S], seq 3979311090, win 14600, options [mss 1460,nop,nop,sackOK,nop,wscale 7], length 0
17:09:32.693703 IP 10.0.11.46.57874 > 10.0.31.139.8081: Flags [R], seq 3979311091, win 0, length 0
17:09:32.698483 IP 10.0.11.40.1362 > 10.0.31.139.8081: Flags [S], seq 763332643, win 14600, options [mss 1460,nop,nop,sackOK,nop,wscale 7], length 0
17:09:32.698592 IP 10.0.11.40.1362 > 10.0.31.139.8081: Flags [R], seq 763332644, win 0, length 0
17:09:32.699210 IP 10.0.11.47.29611 > 10.0.31.139.8081: Flags [S], seq 1273359984, win 14600, options [mss 1460,nop,nop,sackOK,nop,wscale 7], length 0
17:09:32.699325 IP 10.0.11.47.29611 > 10.0.31.139.8081: Flags [R], seq 1273359985, win 0, length 0
17:09:32.700860 IP 10.0.11.45.41054 > 10.0.31.139.8081: Flags [S], seq 1369107131, win 14600, options [mss 1460,nop,nop,sackOK,nop,wscale 7], length 0
17:09:32.700978 IP 10.0.11.45.41054 > 10.0.31.139.8081: Flags [R], seq 1369107132, win 0, length 0
17:09:32.704151 IP 10.0.11.45.41062 > 10.0.31.139.8081: Flags [S], seq 141842487, win 14600, options [mss 1460,nop,nop,sackOK,nop,wscale 7], length 0
17:09:32.704307 IP 10.0.11.45.41062 > 10.0.31.139.8081: Flags [R], seq 141842488, win 0, length 0
17:09:32.709048 IP 10.0.11.32.20203 > 10.0.31.139.8081: Flags [S], seq 3421928242, win 14600, options [mss 1460,nop,nop,sackOK,nop,wscale 7], length 0
17:09:32.709048 IP 10.0.11.32.20203 > 10.0.31.139.8081: Flags [R], seq 3421928243, win 0, length 0
17:09:32.713946 IP 10.0.11.45.41086 > 10.0.31.139.8081: Flags [S], seq 1474311741, win 14600, options [mss 1460,nop,nop,sackOK,nop,wscale 7], length 0
17:09:32.714078 IP 10.0.11.45.41086 > 10.0.31.139.8081: Flags [R], seq 1474311742, win 0, length 0
17:09:32.715486 IP 10.0.11.46.57946 > 10.0.31.139.8081: Flags [S], seq 2896206045, win 14600, options [mss 1460,nop,nop,sackOK,nop,wscale 7], length 0
17:09:32.715598 IP 10.0.11.46.57946 > 10.0.31.139.8081: Flags [R], seq 2896206046, win 0, length 0
17:09:32.720394 IP 10.0.11.46.57967 > 10.0.31.139.8081: Flags [S], seq 2007921976, win 14600, options [mss 1460,nop,nop,sackOK,nop,wscale 7], length 0
17:09:32.720579 IP 10.0.11.46.57967 > 10.0.31.139.8081: Flags [R], seq 2007921977, win 0, length 0
17:09:32.721813 IP 10.0.11.40.1454 > 10.0.31.139.8081: Flags [S], seq 1591487, win 14600, options [mss 1460,nop,nop,sackOK,nop,wscale 7], length 0
17:09:32.721947 IP 10.0.11.40.1454 > 10.0.31.139.8081: Flags [R], seq 1591488, win 0, length 0
17:09:32.723290 IP 10.0.11.40.1464 > 10.0.31.139.8081: Flags [S], seq 3035255625, win 14600, options [mss 1460,nop,nop,sackOK,nop,wscale 7], length 0
17:09:32.723416 IP 10.0.11.40.1464 > 10.0.31.139.8081: Flags [R], seq 3035255626, win 0, length 0
17:09:32.726664 IP 10.0.11.45.41123 > 10.0.31.139.8081: Flags [S], seq 841699161, win 14600, options [mss 1460,nop,nop,sackOK,nop,wscale 7], length 0
17:09:32.726804 IP 10.0.11.45.41123 > 10.0.31.139.8081: Flags [R], seq 841699162, win 0, length 0
17:09:32.733546 IP 10.0.11.34.1788 > 10.0.31.139.8081: Flags [S], seq 2396820377, win 14600, options [mss 1460,nop,nop,sackOK,nop,wscale 7], length 0
17:09:32.733546 IP 10.0.11.32.20283 > 10.0.31.139.8081: Flags [S], seq 2415667889, win 14600, options [mss 1460,nop,nop,sackOK,nop,wscale 7], length 0
17:09:32.733546 IP 10.0.11.34.1788 > 10.0.31.139.8081: Flags [R], seq 2396820378, win 0, length 0
17:09:32.733546 IP 10.0.11.32.20283 > 10.0.31.139.8081: Flags [R], seq 2415667890, win 0, length 0
17:09:32.734471 IP 10.0.11.41.34344 > 10.0.31.139.8081: Flags [S], seq 183526764, win 14600, options [mss 1460,nop,nop,sackOK,nop,wscale 7], length 0
17:09:32.734609 IP 10.0.11.41.34344 > 10.0.31.139.8081: Flags [R], seq 183526765, win 0, length 0
17:09:32.736046 IP 10.0.11.32.20297 > 10.0.31.139.8081: Flags [S], seq 1473394783, win 14600, options [mss 1460,nop,nop,sackOK,nop,wscale 7], length 0
17:09:32.736046 IP 10.0.11.32.20297 > 10.0.31.139.8081: Flags [R], seq 1473394784, win 0, length 0
17:09:32.736046 IP 10.0.11.41.34352 > 10.0.31.139.8081: Flags [S], seq 2290048961, win 14600, options [mss 1460,nop,nop,sackOK,nop,wscale 7], length 0
17:09:32.736046 IP 10.0.11.41.34352 > 10.0.31.139.8081: Flags [R], seq 2290048962, win 0, length 0
17:09:32.739176 IP 10.0.11.45.41138 > 10.0.31.139.8081: Flags [S], seq 4188648663, win 14600, options [mss 1460,nop,nop,sackOK,nop,wscale 7], length 0
17:09:32.739291 IP 10.0.11.45.41138 > 10.0.31.139.8081: Flags [R], seq 4188648664, win 0, length 0
17:09:32.744298 IP 10.0.11.45.41160 > 10.0.31.139.8081: Flags [S], seq 2467806362, win 14600, options [mss 1460,nop,nop,sackOK,nop,wscale 7], length 0
17:09:32.744298 IP 10.0.11.45.41160 > 10.0.31.139.8081: Flags [R], seq 2467806363, win 0, length 0
17:09:32.746302 IP 10.0.11.45.41164 > 10.0.31.139.8081: Flags [S], seq 1379514424, win 14600, options [mss 1460,nop,nop,sackOK,nop,wscale 7], length 0
17:09:32.746302 IP 10.0.11.45.41164 > 10.0.31.139.8081: Flags [R], seq 1379514425, win 0, length 0
17:09:32.749327 IP 10.0.11.47.29761 > 10.0.31.139.8081: Flags [S], seq 1812514019, win 14600, options [mss 1460,nop,nop,sackOK,nop,wscale 7], length 0
17:09:32.749327 IP 10.0.11.47.29761 > 10.0.31.139.8081: Flags [R], seq 1812514020, win 0, length 0
17:09:32.749327 IP 10.0.11.41.34412 > 10.0.31.139.8081: Flags [S], seq 2609689767, win 14600, options [mss 1460,nop,nop,sackOK,nop,wscale 7], length 0
17:09:32.749327 IP 10.0.11.41.34412 > 10.0.31.139.8081: Flags [R], seq 2609689768, win 0, length 0
17:09:32.756613 IP 10.0.11.40.1598 > 10.0.31.139.8081: Flags [S], seq 992283287, win 14600, options [mss 1460,nop,nop,sackOK,nop,wscale 7], length 0
17:09:32.756716 IP 10.0.11.45.41193 > 10.0.31.139.8081: Flags [S], seq 3176712149, win 14600, options [mss 1460,nop,nop,sackOK,nop,wscale 7], length 0
17:09:32.756743 IP 10.0.11.40.1598 > 10.0.31.139.8081: Flags [R], seq 992283288, win 0, length 0
17:09:32.756819 IP 10.0.11.45.41193 > 10.0.31.139.8081: Flags [R], seq 3176712150, win 0, length 0
17:09:32.760502 IP 10.0.11.40.1624 > 10.0.31.139.8081: Flags [S], seq 3931046120, win 14600, options [mss 1460,nop,nop,sackOK,nop,wscale 7], length 0
17:09:32.760619 IP 10.0.11.40.1624 > 10.0.31.139.8081: Flags [R], seq 3931046121, win 0, length 0
17:09:32.761539 IP 10.0.11.46.58137 > 10.0.31.139.8081: Flags [S], seq 1661960860, win 14600, options [mss 1460,nop,nop,sackOK,nop,wscale 7], length 0
17:09:32.764533 IP 10.0.11.40.1630 > 10.0.31.139.8081: Flags [S], seq 785104212, win 14600, options [mss 1460,nop,nop,sackOK,nop,wscale 7], length 0
17:09:32.764659 IP 10.0.11.46.58137 > 10.0.31.139.8081: Flags [R], seq 1661960861, win 0, length 0
17:09:32.764659 IP 10.0.11.40.1630 > 10.0.31.139.8081: Flags [R], seq 785104213, win 0, length 0
17:09:32.764659 IP 10.0.11.41.34468 > 10.0.31.139.8081: Flags [S], seq 4279356206, win 14600, options [mss 1460,nop,nop,sackOK,nop,wscale 7], length 0
17:09:32.764659 IP 10.0.11.41.34468 > 10.0.31.139.8081: Flags [R], seq 4279356207, win 0, length 0
17:09:32.766207 IP 10.0.11.40.1652 > 10.0.31.139.8081: Flags [S], seq 4172633120, win 14600, options [mss 1460,nop,nop,sackOK,nop,wscale 7], length 0
17:09:32.766376 IP 10.0.11.40.1652 > 10.0.31.139.8081: Flags [R], seq 4172633121, win 0, length 0
17:09:32.766716 IP 10.0.11.47.29819 > 10.0.31.139.8081: Flags [S], seq 84399615, win 14600, options [mss 1460,nop,nop,sackOK,nop,wscale 7], length 0
17:09:32.766865 IP 10.0.11.47.29819 > 10.0.31.139.8081: Flags [R], seq 84399616, win 0, length 0
17:09:32.771204 IP 10.0.11.46.58173 > 10.0.31.139.8081: Flags [S], seq 477696751, win 14600, options [mss 1460,nop,nop,sackOK,nop,wscale 7], length 0
17:09:32.771329 IP 10.0.11.46.58173 > 10.0.31.139.8081: Flags [R], seq 477696752, win 0, length 0
17:09:32.773135 IP 10.0.11.34.1995 > 10.0.31.139.8081: Flags [S], seq 3038322075, win 14600, options [mss 1460,nop,nop,sackOK,nop,wscale 7], length 0
17:09:32.773291 IP 10.0.11.34.1995 > 10.0.31.139.8081: Flags [R], seq 3038322076, win 0, length 0
17:09:32.773737 IP 10.0.11.47.29848 > 10.0.31.139.8081: Flags [S], seq 3022064626, win 14600, options [mss 1460,nop,nop,sackOK,nop,wscale 7], length 0
17:09:32.773849 IP 10.0.11.47.29848 > 10.0.31.139.8081: Flags [R], seq 3022064627, win 0, length 0
17:09:32.775923 IP 10.0.11.41.34539 > 10.0.31.139.8081: Flags [S], seq 1981523446, win 14600, options [mss 1460,nop,nop,sackOK,nop,wscale 7], length 0
17:09:32.776035 IP 10.0.11.41.34539 > 10.0.31.139.8081: Flags [R], seq 1981523447, win 0, length 0
17:09:32.782878 IP 10.0.11.34.2047 > 10.0.31.139.8081: Flags [S], seq 1273767767, win 14600, options [mss 1460,nop,nop,sackOK,nop,wscale 7], length 0
17:09:32.783003 IP 10.0.11.34.2047 > 10.0.31.139.8081: Flags [R], seq 1273767768, win 0, length 0
17:09:32.787924 IP 10.0.11.46.58223 > 10.0.31.139.8081: Flags [S], seq 2250717573, win 14600, options [mss 1460,nop,nop,sackOK,nop,wscale 7], length 0
17:09:32.788235 IP 10.0.11.46.58223 > 10.0.31.139.8081: Flags [R], seq 2250717574, win 0, length 0
17:09:32.790001 IP 10.0.11.47.29916 > 10.0.31.139.8081: Flags [S], seq 844903719, win 14600, options [mss 1460,nop,nop,sackOK,nop,wscale 7], length 0
17:09:32.790164 IP 10.0.11.47.29916 > 10.0.31.139.8081: Flags [R], seq 844903720, win 0, length 0
17:09:32.807361 IP 10.0.11.41.34617 > 10.0.31.139.8081: Flags [S], seq 3382082943, win 14600, options [mss 1460,nop,nop,sackOK,nop,wscale 7], length 0
17:09:32.807415 IP 10.0.11.32.20457 > 10.0.31.139.8081: Flags [S], seq 2908636163, win 14600, options [mss 1460,nop,nop,sackOK,nop,wscale 7], length 0
17:09:32.807494 IP 10.0.11.32.20480 > 10.0.31.139.8081: Flags [S], seq 2630176446, win 14600, options [mss 1460,nop,nop,sackOK,nop,wscale 7], length 0
17:09:32.807510 IP 10.0.11.34.2155 > 10.0.31.139.8081: Flags [S], seq 1198875058, win 14600, options [mss 1460,nop,nop,sackOK,nop,wscale 7], length 0
17:09:32.807522 IP 10.0.11.41.34617 > 10.0.31.139.8081: Flags [R], seq 3382082944, win 0, length 0
17:09:32.807526 IP 10.0.11.47.29983 > 10.0.31.139.8081: Flags [S], seq 2854033073, win 14600, options [mss 1460,nop,nop,sackOK,nop,wscale 7], length 0
17:09:32.807537 IP 10.0.11.32.20457 > 10.0.31.139.8081: Flags [R], seq 2908636164, win 0, length 0
17:09:32.807612 IP 10.0.11.34.2155 > 10.0.31.139.8081: Flags [R], seq 1198875059, win 0, length 0
17:09:32.807680 IP 10.0.11.47.29983 > 10.0.31.139.8081: Flags [R], seq 2854033074, win 0, length 0

请问这是tcpcopy的问题吗？谢谢！
