### ISSUE TITLE
offline mode not work 抓包数据

### ISSUE THREAD

**Issue by cway** [session-replay-tools/tcpcopy#220]
抓包之后的内容如下:
127.0.0.1.7032 > 127.0.0.1.36524: Flags [S], cksum 0xfe20 (incorrect -> 0x5e3a), seq 466604327, win 43690, options [mss 65495], length 0
    127.0.0.1.36524 > 127.0.0.1.7032: Flags [S.], cksum 0xfe20 (incorrect -> 0xe9b2), seq 3276517674, ack 466604328, win 43690, options [mss 65495], length 0
    127.0.0.1.7032 > 127.0.0.1.36524: Flags [.], cksum 0xfe1c (incorrect -> 0xfb93), seq 1, ack 1, win 43690, length 0
    127.0.0.1.7033 > 127.0.0.1.36524: Flags [S], cksum 0xfe20 (incorrect -> 0xa160), seq 1549487476, win 43690, options [mss 65495], length 0
    127.0.0.1.36524 > 127.0.0.1.7033: Flags [S.], cksum 0xfe20 (incorrect -> 0x6a8d), seq 2366548403, ack 1549487477, win 43690, options [mss 65495], length 0
    127.0.0.1.7033 > 127.0.0.1.36524: Flags [.], cksum 0xfe1c (incorrect -> 0x7c6e), seq 1, ack 1, win 43690, length 0
    127.0.0.1.7034 > 127.0.0.1.36524: Flags [S], cksum 0xfe20 (incorrect -> 0x89ae), seq 1482254631, win 43690, options [mss 65495], length 0
    127.0.0.1.36524 > 127.0.0.1.7034: Flags [S.], cksum 0xfe20 (incorrect -> 0x83dc), seq 2504880243, ack 1482254632, win 43690, options [mss 65495], length 0
    127.0.0.1.7034 > 127.0.0.1.36524: Flags [.], cksum 0xfe1c (incorrect -> 0x95bd), seq 1, ack 1, win 43690, length 0
    127.0.0.1.7032 > 127.0.0.1.36524: Flags [F.], cksum 0xfe1c (incorrect -> 0xfb92), seq 1, ack 1, win 43690, length 0
    127.0.0.1.7033 > 127.0.0.1.36524: Flags [F.], cksum 0xfe1c (incorrect -> 0x7c6d), seq 1, ack 1, win 43690, length 0
    127.0.0.1.7034 > 127.0.0.1.36524: Flags [F.], cksum 0xfe1c (incorrect -> 0x95bc), seq 1, ack 1, win 43690, length 0
    127.0.0.1.36524 > 127.0.0.1.7032: Flags [F.], cksum 0xfe1c (incorrect -> 0xfb91), seq 1, ack 2, win 43690, length 0
    127.0.0.1.7032 > 127.0.0.1.36524: Flags [.], cksum 0xfe1c (incorrect -> 0xfb91), seq 2, ack 2, win 43690, length 0
    127.0.0.1.36524 > 127.0.0.1.7033: Flags [F.], cksum 0xfe1c (incorrect -> 0x7c6c), seq 1, ack 2, win 43690, length 0
    127.0.0.1.7033 > 127.0.0.1.36524: Flags [.], cksum 0xfe1c (incorrect -> 0x7c6c), seq 2, ack 2, win 43690, length 0
    127.0.0.1.36524 > 127.0.0.1.7034: Flags [F.], cksum 0xfe1c (incorrect -> 0x95bb), seq 1, ack 2, win 43690, length 0
    127.0.0.1.7034 > 127.0.0.1.36524: Flags [.], cksum 0xfe1c (incorrect -> 0x95bb), seq 2, ack 2, win 43690, length 0

7032-7034是tcpcopy和intercept 建立链接的端口 

请帮忙分析下问题原因
____________________________________________________________
./intercept
./tcpcopy -i online.pcap -x 9090-127.0.0.1:9090
i use this tow command to execute tcpcopy and intercept.
use nginx listen 9090 on local server. but nginx not receive any request.

the error_intercept is : 
2015/07/28 17:39:09 +397 [notice] total resp packs:14, all:14, route:0
2015/07/28 17:39:09 +397 [notice] cache hit:0,missed:0,lost:14
2015/07/28 17:39:09 +397 [notice] search:14,extra compared:0,all sessions:0
2015/07/28 17:39:09 +397 [notice] delay total:0
2015/07/28 17:39:09 +398 [notice] delay delete obsolete :0
2015/07/28 17:39:14 +398 [notice] total resp packs:14, all:14, route:0
2015/07/28 17:39:14 +398 [notice] cache hit:0,missed:0,lost:14
2015/07/28 17:39:14 +398 [notice] search:14,extra compared:0,all sessions:0
2015/07/28 17:39:14 +398 [notice] delay total:0
2015/07/28 17:39:14 +399 [notice] delay delete obsolete :0
2015/07/28 17:39:19 +399 [notice] total resp packs:14, all:14, route:0
2015/07/28 17:39:19 +399 [notice] cache hit:0,missed:0,lost:14
2015/07/28 17:39:19 +399 [notice] search:14,extra compared:0,all sessions:0
2015/07/28 17:39:19 +399 [notice] delay total:0
2015/07/28 17:39:19 +400 [notice] delay delete obsolete :0
2015/07/28 17:39:24 +400 [notice] total resp packs:14, all:14, route:0
2015/07/28 17:39:24 +400 [notice] cache hit:0,missed:0,lost:14
2015/07/28 17:39:24 +400 [notice] search:14,extra compared:0,all sessions:0
2015/07/28 17:39:24 +400 [notice] delay total:0
2015/07/28 17:39:24 +401 [notice] delay delete obsolete :0
2015/07/28 17:39:29 +401 [notice] total resp packs:14, all:14, route:0
2015/07/28 17:39:29 +401 [notice] cache hit:0,missed:0,lost:14
2015/07/28 17:39:29 +401 [notice] search:14,extra compared:0,all sessions:0
2015/07/28 17:39:29 +401 [notice] delay total:0
2015/07/28 17:39:29 +402 [notice] delay delete obsolete :0
2015/07/28 17:39:34 +402 [notice] total resp packs:14, all:14, route:0
2015/07/28 17:39:34 +402 [notice] cache hit:0,missed:0,lost:14
2015/07/28 17:39:34 +402 [notice] search:14,extra compared:0,all sessions:0
2015/07/28 17:39:34 +402 [notice] delay total:0
2015/07/28 17:39:34 +403 [notice] delay delete obsolete :0
2015/07/28 17:39:39 +403 [notice] total resp packs:14, all:14, route:0
2015/07/28 17:39:39 +403 [notice] cache hit:0,missed:0,lost:14
2015/07/28 17:39:39 +403 [notice] search:14,extra compared:0,all sessions:0
2015/07/28 17:39:39 +403 [notice] delay total:0
2015/07/28 17:39:39 +404 [notice] delay delete obsolete :0

the error_tcpcopy.log is : 
2015/07/28 17:38:39 +481 [notice] session size:0
2015/07/28 17:38:39 +482 [notice] activate_dead_sessions
2015/07/28 17:38:44 +482 [notice] session size:0
2015/07/28 17:38:44 +483 [notice] activate_dead_sessions
2015/07/28 17:38:49 +483 [notice] session size:0
2015/07/28 17:38:49 +484 [notice] activate_dead_sessions
2015/07/28 17:38:54 +484 [notice] session size:0
2015/07/28 17:38:54 +485 [notice] activate_dead_sessions
2015/07/28 17:38:59 +485 [notice] session size:0
2015/07/28 17:38:59 +486 [notice] activate_dead_sessions
2015/07/28 17:39:04 +486 [notice] session size:0
2015/07/28 17:39:04 +487 [notice] activate_dead_sessions
2015/07/28 17:39:09 +487 [notice] session size:0
2015/07/28 17:39:09 +488 [notice] activate_dead_sessions
2015/07/28 17:39:10 +611 [notice] user time used:19
2015/07/28 17:39:10 +611 [notice] sys time used:18
2015/07/28 17:39:10 +611 [notice] max memory size:8012
2015/07/28 17:39:14 +488 [notice] session size:0
2015/07/28 17:39:14 +489 [notice] activate_dead_sessions
2015/07/28 17:39:19 +489 [notice] session size:0
2015/07/28 17:39:19 +490 [notice] activate_dead_sessions
2015/07/28 17:39:24 +490 [notice] session size:0
2015/07/28 17:39:24 +491 [notice] activate_dead_sessions
2015/07/28 17:39:29 +491 [notice] session size:0
2015/07/28 17:39:29 +492 [notice] activate_dead_sessions
2015/07/28 17:39:34 +492 [notice] session size:0
2015/07/28 17:39:34 +493 [notice] activate_dead_sessions
2015/07/28 17:39:39 +493 [notice] session size:0
2015/07/28 17:39:39 +494 [notice] activate_dead_sessions
2015/07/28 17:39:44 +494 [notice] session size:0
2015/07/28 17:39:44 +495 [notice] activate_dead_sessions
2015/07/28 17:39:45 +000 [notice] offline replay is complete
2015/07/28 17:39:45 +001 [warn] sig 64 received
2015/07/28 17:39:45 +001 [notice] remove timer over
2015/07/28 17:39:45 +001 [notice] enter destroy_for_sessions
2015/07/28 17:39:45 +008 [notice] total visit hash_find_node:0,compared:0
2015/07/28 17:39:45 +008 [notice] destroy items 0 in table name:transfer port table
2015/07/28 17:39:45 +008 [notice] leave destroy_for_sessions
2015/07/28 17:39:45 +008 [notice] tc_event_loop_finish over
2015/07/28 17:39:45 +008 [notice] it close socket:4
2015/07/28 17:39:45 +008 [notice] it close socket:5
2015/07/28 17:39:45 +008 [notice] it close socket:6
2015/07/28 17:39:45 +008 [notice] destroy addr table
2015/07/28 17:39:45 +008 [notice] total visit hash_find_node:4,compared:2
版本 0.9

**Comment by wangbin579** [comment]
抓包数据，请抓9090端口的数据。

这种问题，99.99%都不是tcpcopy自身的问题导致的

**Comment by cway** [comment]
9090接收不到任何数据

**Comment by cway** [comment]
tcpdump 没有数据

**Comment by wangbin579** [comment]
检测一下online.pcap是否有9090的数据

**Comment by cway** [comment]
OK 明白了 多谢：）
