### ISSUE TITLE
求助

### ISSUE THREAD

**Issue by tansunyj** [session-replay-tools/tcpcopy#214]
嗨，wangbin579，你好：
想学习tcpcopy进行线上压测模拟，出现测试服务器无压力的情况，详情如下：
内核:Linux performancetest2-efz6b.vclound.com 2.6.18-308.el5 #1 SMP Tue Feb 21 20:06:06 EST 2012 x86_64 x86_64 x86_64 GNU/Linux
线上服务器：10.199.144.110，部署php-fpm+nginx，nginx对外端口：8080
测试服务器：10.199.144.112，部署php-fpm+nginx，nginx对外端口：8088
intercept服务器：10.199.144.159
压力服务器：10.199.144.157
各服务器route、iptables按照http://blog.csdn.net/wangbin579/article/details/8950282所说进行配置；

在压力服务器模拟大量请求时，只有少量的请求可以正确到达测试服务器，测试服务器上的日志、tcpdump信息如下：
nginx日志：
    10.199.144.157 - - [09/Jul/2015:14:44:04 +0800] "GET /info.php HTTP/1.1" 499 0 "-" "Apache-HttpClient/4.2.6 (java 1.5)"
10.199.144.157 - - [09/Jul/2015:14:44:04 +0800] "GET /info.php HTTP/1.1" 499 0 "-" "Apache-HttpClient/4.2.6 (java 1.5)"
10.199.144.157 - - [09/Jul/2015:14:44:04 +0800] "GET /info.php HTTP/1.1" 200 0 "-" "Apache-HttpClient/4.2.6 (java 1.5)"
10.199.144.157 - - [09/Jul/2015:14:44:04 +0800] "-" 400 0 "-" "-"
10.199.144.157 - - [09/Jul/2015:14:44:04 +0800] "GET /info.php HTTP/1.1" 200 0 "-" "Apache-HttpClient/4.2.6 (java 1.5)"
10.199.144.157 - - [09/Jul/2015:14:44:04 +0800] "GET /info.php HTTP/1.1" 200 0 "-" "Apache-HttpClient/4.2.6 (java 1.5)"
10.199.144.157 - - [09/Jul/2015:14:44:04 +0800] "GET /info.php HTTP/1.1" 200 0 "-" "Apache-HttpClient/4.2.6 (java 1.5)"
10.199.144.157 - - [09/Jul/2015:14:44:04 +0800] "GET /info.php HTTP/1.1" 499 0 "-" "Apache-HttpClient/4.2.6 (java 1.5)"
10.199.144.157 - - [09/Jul/2015:14:44:04 +0800] "-" 400 0 "-" "-"
10.199.144.157 - - [09/Jul/2015:14:44:04 +0800] "GET /info.php HTTP/1.1" 200 35072 "-" "Apache-HttpClient/4.2.6 (java 1.5)"
10.199.144.157 - - [09/Jul/2015:14:44:04 +0800] "GET /info.php HTTP/1.1" 200 0 "-" "Apache-HttpClient/4.2.6 (java 1.5)"

tcpdump得到的pcap文件如下：
1	0.000000	10.199.144.157	10.199.144.112	TCP	60	49983→8088 [RST] Seq=1 Win=0 Len=0
2	0.003359	10.199.144.157	10.199.144.112	TCP	60	49930→8088 [SYN] Seq=0 Win=65535 Len=0 MSS=1460
3	0.003683	10.199.144.157	10.199.144.112	TCP	60	49930→8088 [RST] Seq=1 Win=0 Len=0
4	0.003776	10.199.144.157	10.199.144.112	TCP	60	49930→8088 [ACK] Seq=1 Ack=1 Win=65535 Len=0
5	0.003796	10.199.144.157	10.199.144.112	HTTP	191	GET /info.php HTTP/1.1 [Packet size limited during capture]
"6","0.005951","10.199.144.157","10.199.144.112","TCP","60","49972→8088 [SYN] Seq=0 Win=65535 Len=0 MSS=1460"
7	0.006040	10.199.144.157	10.199.144.112	TCP	60	49930→8088 [ACK] Seq=1 Ack=1 Win=65535 Len=0
8	0.006370	10.199.144.157	10.199.144.112	TCP	60	49972→8088 [ACK] Seq=1 Ack=1 Win=65535 Len=0
9	0.006388	10.199.144.157	10.199.144.112	HTTP	191	GET /info.php HTTP/1.1 [Packet size limited during capture]
10	0.006413	10.199.144.157	10.199.144.112	TCP	60	49972→8088 [RST] Seq=1 Win=0 Len=0
11	0.006724	10.199.144.157	10.199.144.112	TCP	60	49972→8088 [RST] Seq=126 Win=0 Len=0
12	0.006981	10.199.144.157	10.199.144.112	TCP	60	49972→8088 [ACK] Seq=1 Ack=1 Win=65535 Len=0
13	0.007010	10.199.144.157	10.199.144.112	TCP	60	49942→8088 [SYN] Seq=0 Win=65535 Len=0 MSS=1460
14	0.007576	10.199.144.157	10.199.144.112	TCP	60	49942→8088 [RST] Seq=1 Win=0 Len=0
15	0.009966	10.199.144.157	10.199.144.112	TCP	60	49967→8088 [SYN] Seq=0 Win=65535 Len=0 MSS=1460
16	0.010083	10.199.144.157	10.199.144.112	TCP	60	49942→8088 [ACK] Seq=1 Ack=1 Win=65535 Len=0
17	0.010106	10.199.144.157	10.199.144.112	HTTP	191	GET /info.php HTTP/1.1 [Packet size limited during capture]
19	0.010320	10.199.144.157	10.199.144.112	TCP	60	49967→8088 [RST] Seq=1 Win=0 Len=0
20	0.010324	10.199.144.157	10.199.144.112	TCP	60	49891→8088 [SYN] Seq=0 Win=65535 Len=0 MSS=1460

其中：[RST]的行全部为红色；

线上服务器、测试服务器的请求相差巨大，能帮忙看看是哪里出了问题吗？

**Comment by wangbin579** [comment]
路由是如何设置的？
从 抓包来看，路由貌似没有设置正确。

**Comment by wangbin579** [comment]
2 0.003359 10.199.144.157 10.199.144.112 TCP 60 49930→8088 [SYN] Seq=0 Win=65535 Len=0 MSS=1460
3 0.003683 10.199.144.157 10.199.144.112 TCP 60 49930→8088 [RST] Seq=1 Win=0 Len=0
4 0.003776 10.199.144.157 10.199.144.112 TCP 60 49930→8088 [ACK] Seq=1 Ack=1 Win=65535 Len=0

从上面来看，路由给辅助服务器10.199.144.159的数据包，跑回了真正的客户端，最大可能是10.199.144.159设置了ip_forward，导致应答数据包没有被黑洞掉。

你可以跑去10.199.144.157，看看有没有10.199.144.159过来的应答包，就可以判断了。
