### ISSUE TITLE
Many connections can't be established.

### ISSUE THREAD

**Issue by slin1972** [session-replay-tools/tcpcopy#235]
本人新手，请指点
今天搭建tcp copy的时候出现了以下问题
topcopy为1.0版本
正式服务器172.31.30.2
sbin/tcpcopy -x 80-172.31.20.108:10091 -s 172.31.17.108 -c 172.31.100.x -d -C 4 -l /var/log/tcpcopy.log
测试服务器172.31.17.108
route add -net 172.31.100.0 netmask 255.255.255.0 gw 172.31.17.69
辅助服务器 172.31.20.69
sbin/intercept -i eth0 -F 'tcp and src port 10091' -d

tcpcopy.log
[root@ip-172-31-30-2 local]# tailf /var/log/tcpcopy.log 
2015/12/21 14:17:00 +633 [notice] set global port for tcpcopy
2015/12/21 14:17:00 +633 [notice] parallel connections per target:4
2015/12/21 14:17:00 +633 [notice] s parameter:172.31.20.69
2015/12/21 14:17:00 +633 [notice] set only ip for tcpcopy
2015/12/21 14:17:00 +633 [info] pool:24523680,block:24540080,len:44 occupy
2015/12/21 14:17:00 +633 [info] pool:24523680,block:24540080,len:44 occupy
2015/12/21 14:17:00 +633 [info] connect to remote server(172.31.20.69:36524)
2015/12/21 14:17:00 +633 [info] connect to remote server(172.31.20.69:36524)
2015/12/21 14:17:00 +633 [info] connect to remote server(172.31.20.69:36524)
2015/12/21 14:17:00 +633 [info] connect to remote server(172.31.20.69:36524)

2015/12/21 14:17:30 +633 [notice] active:13,rel:49,obs del:0,tw:12
2015/12/21 14:17:30 +633 [notice] conns:0,resp:0,c-resp:0
2015/12/21 14:17:30 +633 [notice] resp fin:0,resp rst:0
2015/12/21 14:17:30 +633 [notice] send:123,send content:0
2015/12/21 14:17:30 +633 [notice] send syn:62, fin:0,reset:61
2015/12/21 14:17:30 +633 [notice] reconnect:0,for no syn:48
2015/12/21 14:17:30 +633 [notice] retransmit:0
2015/12/21 14:17:30 +633 [notice] recv packs after retransmission:0
2015/12/21 14:17:30 +633 [notice] syn cnt:14,all clt:826,clt cont:66
2015/12/21 14:17:30 +633 [notice] total cont retransmit:0, frag:238
2015/12/21 14:17:30 +633 [notice] total captured packets:5349
2015/12/21 14:17:30 +633 [warn] many connections can't be established

但是辅助服务器是有连接的
tcp    ESTAB      0      0                                                                          172.31.17.69:36524                                                                        172.31.30.2:56794   
tcp    ESTAB      0      0                                                                          172.31.17.69:36524                                                                        172.31.30.2:56792   
tcp    ESTAB      0      260                                                                        172.31.17.69:ssh                                                                       61.141.136.235:39138   
tcp    ESTAB      0      0                                                                          172.31.17.69:36524                                                                        172.31.30.2:56793   
tcp    ESTAB      0      0                                                                          172.31.17.69:36524                                                                        172.31.30.2:56791

辅助服务器tcpdump也有数据
tcpdump port 36524
tcpdump: verbose output suppressed, use -v or -vv for full protocol decode
listening on eth0, link-type EN10MB (Ethernet), capture size 65535 bytes
14:25:08.340968 IP ip-172-31-30-2.ap-southeast-1.compute.internal.42550 > ip-172-31-20-108.ap-southeast-1.compute.internal.36524: Flags [P.], seq 1655594866:1655594880, ack 3367314229, win 115, options [nop,nop,TS val 2044860979 ecr 1052386100], length 14
14:25:08.340978 IP ip-172-31-20-108.ap-southeast-1.compute.internal.36524 > ip-172-31-30-2.ap-southeast-1.compute.internal.42550: Flags [.], ack 14, win 140, options [nop,nop,TS val 1052387279 ecr 2044860979], length 0
14:25:08.626413 IP ip-172-31-30-2.ap-southeast-1.compute.internal.42551 > ip-172-31-20-108.ap-southeast-1.compute.internal.36524: Flags [P.], seq 1260252717:1260252731, ack 549714522, win 115, options [nop,nop,TS val 2044861265 ecr 1052386356], length 14
14:25:08.626423 IP ip-172-31-20-108.ap-southeast-1.compute.internal.36524 > ip-172-31-30-2.ap-southeast-1.compute.internal.42551: Flags [.], ack 14, win 140, options [nop,nop,TS val 1052387564 ecr 2044861265], length 0
14:25:08.724057 IP ip-172-31-30-2.ap-southeast-1.compute.internal.42552 > ip-172-31-20-108.ap-southeast-1.compute.internal.36524: Flags [P.], seq 2351627466:2351627480, ack 2435413846, win 115, options [nop,nop,TS val 2044861362 ecr 1052386956], length 14
14:25:08.724065 IP ip-172-31-20-108.ap-southeast-1.compute.internal.36524 > ip-172-31-30-2.ap-southeast-1.compute.internal.42552: Flags [.], ack 14, win 140, options [nop,nop,TS val 1052387662 ecr 2044861362], length 0
14:25:09.155303 IP ip-172-31-30-2.ap-southeast-1.compute.internal.42549 > ip-172-31-20-108.ap-southeast-1.compute.internal.36524: Flags [P.], seq 3544345602:3544345616, ack 2939588008, win 115, options [nop,nop,TS val 2044861793 ecr 1052386980], length 14
14:25:09.155312 IP ip-172-31-20-108.ap-southeast-1.compute.internal.36524 > ip-172-31-30-2.ap-southeast-1.compute.internal.42549: Flags [.], ack 14, win 140, options [nop,nop,TS val 1052388093 ecr 2044861793], length 0
14:25:09.467638 IP ip-172-31-30-2.ap-southeast-1.compute.internal.42550 > ip-172-31-20-108.ap-southeast-1.compute.internal.36524: Flags [P.], seq 14:28, ack 1, win 115, options [nop,nop,TS val 2044862106 ecr 1052387279], length 14
14:25:09.467648 IP ip-172-31-20-108.ap-southeast-1.compute.internal.36524 > ip-172-31-30-2.ap-southeast-1.compute.internal.42550: Flags [.], ack 28, win 140, options [nop,nop,TS val 1052388405 ecr 2044862106], length 0
14:25:09.594270 IP ip-172-31-30-2.ap-southeast-1.compute.internal.42551 > ip-172-31-20-108.ap-southeast-1.compute.internal.36524: Flags [P.], seq 14:28, ack 1, win 115, options [nop,nop,TS val 2044862232 ecr 1052387564], length 14
14:25:09.594279 IP ip-172-31-20-108.ap-southeast-1.compute.internal.36524 > ip-172-31-30-2.ap-southeast-1.compute.internal.42551: Flags [.], ack 28, win 140, options [nop,nop,TS val 1052388532 ecr 2044862232], length 0
14:25:10.181379 IP ip-172-31-30-2.ap-southeast-1.compute.internal.42552 > ip-172-31-20-108.ap-southeast-1.compute.internal.36524: Flags [P.], seq 14:28, ack 1, win 115, options [nop,nop,TS val 2044862819 ecr 1052387662], length 14

/var/log/intercept.log 无日志

测试服务器tcpdump也没有日志

**Comment by slin1972** [comment]
由于我将辅助服务器和测试服务器   多次切换测试   发现一直是这个问题
贴上的日志输出里面的 IP 有些可能辅助ip跟测试ip弄混了.

**Comment by wangbin579** [comment]
这个问题已经重复了好多次，不再解答。
请查询之前的类似记录
