### ISSUE TITLE
【请教】测试服务器上只看到syn，syn+ack,rst包，实际的数据获取不到

### ISSUE THREAD

**Issue by achillies81** [session-replay-tools/tcpcopy#148]
使用版本： tcpcopy0.9.0,  libpcap1.4.0
使用模式：给予 pcap的新模式
使用方式：严格按照：http://blog.csdn.net/wangbin579/article/details/8950282 

在线机器： 192.168.0.60（上面运行一个TCP服务器、tcpcopy，接收来自30多个客户端的数据）
                  192.168.0.61（上面运行一个测试程序，也是TCP服务器）
                   192.168.0.62（上面运行intercept）；
问题现象：1、在192.168.0.61上tcpdump 只能看到来自30多个客户端的sys包及rst
包，但应用层的数据抓取不到；
                 2、192.168.0.61上netstat -antp 能看到众多的 SYN_RECV 状态；
                 3、192.168.0.62上能看到60与其交互的报文；

谢谢！

**Comment by AiFan** [comment]
你好，wangbin.

我也遇到类似的问题，测试服务器能收到SYN包，但收不到后续的SYN ack、数据、RST包，我粘贴下Tcpdump(命令：tcpdump 'tcp port 80 and host 10.105.20.1' -X -s 0)的结果：

A机器(Tcpcopy所在机器):
20:07:59.281731 IP 10.105.20.1.55257 > lg-smart-test00.bj.http: Flags [S], seq 4171115218, win 14600, options [mss 1460,sackOK,TS val 2443035163 ecr 0,nop,wscale 7], length 0
20:07:59.283646 IP 10.105.20.1.55257 > lg-smart-test00.bj.http: Flags [.], ack 1049219178, win 115, options [nop,nop,TS val 2443035163 ecr 4030231851], length 0
20:07:59.283668 IP 10.105.20.1.55257 > lg-smart-test00.bj.http: Flags [P.], seq 0:198, ack 1, win 115, options [nop,nop,TS val 2443035163 ecr 4030231851], length 198
20:07:59.383937 IP 10.105.20.1.55257 > lg-smart-test00.bj.http: Flags [P.], seq 0:198, ack 1, win 115, options [nop,nop,TS val 2443035163 ecr 4030231851], length 198
20:10:02.304629 IP 10.105.20.1.55257 > lg-smart-test00.bj.http: Flags [R.], seq 198, ack 1, win 65535, length 0

B机器(压测服务):
20:07:58.615239 IP 10.105.20.1.55257 > lg-smart-test00.bj.http: Flags [S], seq 4171115218, win 14600, options [mss 1460,sackOK,TS val 2443035163 ecr 0,nop,wscale 7], length 0
20:07:58.615269 IP lg-smart-test00.bj.http > 10.105.20.1.55257: Flags [S.], seq 1049219177, ack 4171115219, win 14480, options [mss 1460,sackOK,TS val 4030231851 ecr 2443035163,nop,wscale 7], length 0
20:08:00.014705 IP lg-smart-test00.bj.http > 10.105.20.1.55257: Flags [S.], seq 1049219177, ack 4171115219, win 14480, options [mss 1460,sackOK,TS val 4030233251 ecr 2443035163,nop,wscale 7], length 0

C机器(Intercept所在机器):
20:07:58.615969 IP lg-smart-test00.bj.http > 10.105.20.1.55257: Flags [S.], seq 1049219177, ack 4171115219, win 14480, options [mss 1460,sackOK,TS val 4030231851 ecr 2443035163,nop,wscale 7], length 0
20:07:58.616011 IP lg-smart-test00.bj.http > 10.105.20.1.55257: Flags [S.], seq 1049219177, ack 4171115219, win 14480, options [mss 1460,sackOK,TS val 4030231851 ecr 2443035163,nop,wscale 7], length 0
20:08:00.015406 IP lg-smart-test00.bj.http > 10.105.20.1.55257: Flags [S.], seq 1049219177, ack 4171115219, win 14480, options [mss 1460,sackOK,TS val 4030233251 ecr 2443035163,nop,wscale 7], length 0
20:08:00.015450 IP lg-smart-test00.bj.http > 10.105.20.1.55257: Flags [S.], seq 1049219177, ack 4171115219, win 14480, options [mss 1460,sackOK,TS val 4030233251 ecr 2443035163,nop,wscale 7], length 0

Tcpcopy启动命令：
tcpcopy -x 80-10.105.5.37:80 -s 10.105.5.161 -c 10.105.20.x -n 1 -l /data/logs/tcpcopy/tcpcopy.log -d

Intercept启动命令：
intercept -i eth0 -F 'tcp and src port 80' -l /data/logs/tcpcopy/intercept.log -d

测试服务器路由表：
Destination     Gateway         Genmask         Flags Metric Ref    Use Iface
10.105.20.0     lg-smart-server 255.255.255.0   UG    0      0        0 eth0

**Comment by wangbin579** [comment]
A机器，其实是发出syn ack的，也发出了请求了，如果测试机器没有抓到这些，最大可能是防火墙干扰的。



2015-09-17






发件人：项灵辉 <notifications@github.com>
发送时间：2015-09-11 20:22
主题：Re: [tcpcopy] 【请教】测试服务器上只看到syn，syn+ack,rst包，实际的数据获取不到 (#148)
收件人："session-replay-tools/tcpcopy"<tcpcopy@noreply.github.com>
抄送："Bin Wang"<wangbin579@gmail.com>

你好，wangbin.
我也遇到类似的问题，测试服务器能收到SYN包，但收不到后续的SYN ack、数据、RST包，我粘贴下Tcpdump(命令：tcpdump 'tcp port 80 and host 10.105.20.1' -X -s 0)的结果：
A机器(Tcpcopy所在机器):
20:07:59.281731 IP 10.105.20.1.55257 > lg-smart-test00.bj.http: Flags [S], seq 4171115218, win 14600, options [mss 1460,sackOK,TS val 2443035163 ecr 0,nop,wscale 7], length 0
20:07:59.283646 IP 10.105.20.1.55257 > lg-smart-test00.bj.http: Flags [.], ack 1049219178, win 115, options [nop,nop,TS val 2443035163 ecr 4030231851], length 0
20:07:59.283668 IP 10.105.20.1.55257 > lg-smart-test00.bj.http: Flags [P.], seq 0:198, ack 1, win 115, options [nop,nop,TS val 2443035163 ecr 4030231851], length 198
20:07:59.383937 IP 10.105.20.1.55257 > lg-smart-test00.bj.http: Flags [P.], seq 0:198, ack 1, win 115, options [nop,nop,TS val 2443035163 ecr 4030231851], length 198
20:10:02.304629 IP 10.105.20.1.55257 > lg-smart-test00.bj.http: Flags [R.], seq 198, ack 1, win 65535, length 0
B机器(压测服务):
20:07:58.615239 IP 10.105.20.1.55257 > lg-smart-test00.bj.http: Flags [S], seq 4171115218, win 14600, options [mss 1460,sackOK,TS val 2443035163 ecr 0,nop,wscale 7], length 0
20:07:58.615269 IP lg-smart-test00.bj.http > 10.105.20.1.55257: Flags [S.], seq 1049219177, ack 4171115219, win 14480, options [mss 1460,sackOK,TS val 4030231851 ecr 2443035163,nop,wscale 7], length 0
20:08:00.014705 IP lg-smart-test00.bj.http > 10.105.20.1.55257: Flags [S.], seq 1049219177, ack 4171115219, win 14480, options [mss 1460,sackOK,TS val 4030233251 ecr 2443035163,nop,wscale 7], length 0
C机器(Intercept所在机器):
20:07:58.615969 IP lg-smart-test00.bj.http > 10.105.20.1.55257: Flags [S.], seq 1049219177, ack 4171115219, win 14480, options [mss 1460,sackOK,TS val 4030231851 ecr 2443035163,nop,wscale 7], length 0
20:07:58.616011 IP lg-smart-test00.bj.http > 10.105.20.1.55257: Flags [S.], seq 1049219177, ack 4171115219, win 14480, options [mss 1460,sackOK,TS val 4030231851 ecr 2443035163,nop,wscale 7], length 0
20:08:00.015406 IP lg-smart-test00.bj.http > 10.105.20.1.55257: Flags [S.], seq 1049219177, ack 4171115219, win 14480, options [mss 1460,sackOK,TS val 4030233251 ecr 2443035163,nop,wscale 7], length 0
20:08:00.015450 IP lg-smart-test00.bj.http > 10.105.20.1.55257: Flags [S.], seq 1049219177, ack 4171115219, win 14480, options [mss 1460,sackOK,TS val 4030233251 ecr 2443035163,nop,wscale 7], length 0
Tcpcopy启动命令：
tcpcopy -x 80-10.105.5.37:80 -s 10.105.5.161 -c 10.105.20.x -n 1 -l /data/logs/tcpcopy/tcpcopy.log -d
Intercept启动命令：
intercept -i eth0 -F 'tcp and src port 80' -l /data/logs/tcpcopy/intercept.log -d
测试服务器路由表：
Destination Gateway Genmask Flags Metric Ref Use Iface
10.105.20.0 lg-smart-server 255.255.255.0 UG 0 0 0 eth0

**Comment by AiFan** [comment]
我用的机器是公司的虚拟机，系统的防火墙、rp_filter我都关了，估计数据被宿主机拦截了.




发自网易邮箱 iPhone 版
在2015年09月17日 13:51，Bin Wang 写道:
A机器，其实是发出syn ack的，也发出了请求了，如果测试机器没有抓到这些，最大可能是防火墙干扰的。



2015-09-17






发件人：项灵辉 <notifications@github.com>
发送时间：2015-09-11 20:22
主题：Re: [tcpcopy] 【请教】测试服务器上只看到syn，syn+ack,rst包，实际的数据获取不到 (#148)
收件人："session-replay-tools/tcpcopy"<tcpcopy@noreply.github.com>
抄送："Bin Wang"<wangbin579@gmail.com>

你好，wangbin.
我也遇到类似的问题，测试服务器能收到SYN包，但收不到后续的SYN ack、数据、RST包，我粘贴下Tcpdump(命令：tcpdump 'tcp port 80 and host 10.105.20.1' -X -s 0)的结果：
A机器(Tcpcopy所在机器):
20:07:59.281731 IP 10.105.20.1.55257 > lg-smart-test00.bj.http: Flags [S], seq 4171115218, win 14600, options [mss 1460,sackOK,TS val 2443035163 ecr 0,nop,wscale 7], length 0
20:07:59.283646 IP 10.105.20.1.55257 > lg-smart-test00.bj.http: Flags [.], ack 1049219178, win 115, options [nop,nop,TS val 2443035163 ecr 4030231851], length 0
20:07:59.283668 IP 10.105.20.1.55257 > lg-smart-test00.bj.http: Flags [P.], seq 0:198, ack 1, win 115, options [nop,nop,TS val 2443035163 ecr 4030231851], length 198
20:07:59.383937 IP 10.105.20.1.55257 > lg-smart-test00.bj.http: Flags [P.], seq 0:198, ack 1, win 115, options [nop,nop,TS val 2443035163 ecr 4030231851], length 198
20:10:02.304629 IP 10.105.20.1.55257 > lg-smart-test00.bj.http: Flags [R.], seq 198, ack 1, win 65535, length 0
B机器(压测服务):
20:07:58.615239 IP 10.105.20.1.55257 > lg-smart-test00.bj.http: Flags [S], seq 4171115218, win 14600, options [mss 1460,sackOK,TS val 2443035163 ecr 0,nop,wscale 7], length 0
20:07:58.615269 IP lg-smart-test00.bj.http > 10.105.20.1.55257: Flags [S.], seq 1049219177, ack 4171115219, win 14480, options [mss 1460,sackOK,TS val 4030231851 ecr 2443035163,nop,wscale 7], length 0
20:08:00.014705 IP lg-smart-test00.bj.http > 10.105.20.1.55257: Flags [S.], seq 1049219177, ack 4171115219, win 14480, options [mss 1460,sackOK,TS val 4030233251 ecr 2443035163,nop,wscale 7], length 0
C机器(Intercept所在机器):
20:07:58.615969 IP lg-smart-test00.bj.http > 10.105.20.1.55257: Flags [S.], seq 1049219177, ack 4171115219, win 14480, options [mss 1460,sackOK,TS val 4030231851 ecr 2443035163,nop,wscale 7], length 0
20:07:58.616011 IP lg-smart-test00.bj.http > 10.105.20.1.55257: Flags [S.], seq 1049219177, ack 4171115219, win 14480, options [mss 1460,sackOK,TS val 4030231851 ecr 2443035163,nop,wscale 7], length 0
20:08:00.015406 IP lg-smart-test00.bj.http > 10.105.20.1.55257: Flags [S.], seq 1049219177, ack 4171115219, win 14480, options [mss 1460,sackOK,TS val 4030233251 ecr 2443035163,nop,wscale 7], length 0
20:08:00.015450 IP lg-smart-test00.bj.http > 10.105.20.1.55257: Flags [S.], seq 1049219177, ack 4171115219, win 14480, options [mss 1460,sackOK,TS val 4030233251 ecr 2443035163,nop,wscale 7], length 0
Tcpcopy启动命令：
tcpcopy -x 80-10.105.5.37:80 -s 10.105.5.161 -c 10.105.20.x -n 1 -l /data/logs/tcpcopy/tcpcopy.log -d
Intercept启动命令：
intercept -i eth0 -F 'tcp and src port 80' -l /data/logs/tcpcopy/intercept.log -d
测试服务器路由表：
Destination Gateway Genmask Flags Metric Ref Use Iface
10.105.20.0 lg-smart-server 255.255.255.0 UG 0 0 0 eth0

**Comment by yuanmomo** [comment]
@AiFan 请问你的问题解决了吗？我也遇到类似的问题了

**Comment by wangkendy** [comment]
我这里遇到了同样的问题。
在target server上和tcpdujp抓包，只看到Syn包是Reset包，连接建立不起来

**Comment by wangbin579** [comment]
这些问题，均不是tcpcopy本身的问题，而是环境限制或者配置不当造成的。

如果要解决此类问题，请详细给出相关信息，才能诊断出真正的原因。
