### ISSUE TITLE
阿里云 + 内网服务器环境，内网服务收不到消息

### ISSUE THREAD

**Issue by yuyetingqin** [session-replay-tools/tcpcopy#347]
1. 版本以及环境简介
tcpcopy version:1.2.0
intercept version:1.0.0
在线服务器：阿里云ECS  
	启动命令：  ./tcpcopy -x 6677-116.32.pb.ip:6677 -s 116.32.pb.ip -c 10.1.3.x -d	
测试服务和 intercept : 内网 10.1.2.135  
	启动命令： ./intercept -i ens192 -F 'tcp and src port 6677' -d	
内网服务器通过端口映射：
	116.32.pb.ip:6677  => 10.1.2.135:6677
	116.32.pb.ip:36524 => 10.1.2.135:36524
服务：
	python -m SimpleHTTPServer 6677
	

2. tcpcopy日志
2019/05/06 15:29:45 +993 [notice] tcpcopy version:1.2.0
2019/05/06 15:29:45 +993 [notice] tcpcopy internal version:6
2019/05/06 15:29:45 +993 [notice] target:6677-116.32.pb.ip:6677
2019/05/06 15:29:45 +993 [notice] TC_COMBINED mode
2019/05/06 15:29:45 +993 [notice] epoll mode
2019/05/06 15:29:45 +993 [notice] session timeout:120
2019/05/06 15:29:45 +993 [notice] keepalive timeout:240
2019/05/06 15:29:45 +993 [notice] min sess pool size:608
2019/05/06 15:29:45 +993 [notice] sess pool size:1024
2019/05/06 15:29:45 +993 [notice] set global port for tcpcopy
2019/05/06 15:29:45 +993 [notice] raw_clt_tf_ip:10.1.2.x
2019/05/06 15:29:45 +993 [notice] parallel connections per target:2
2019/05/06 15:29:45 +993 [notice] s parameter:116.32.pb.ip
2019/05/06 15:29:45 +993 [notice] set only ip for tcpcopy
2019/05/06 15:29:45 +993 [info] connect to remote server(116.32.pb.ip:36524)
2019/05/06 15:29:45 +993 [info] connect to remote server(116.32.pb.ip:36524)
2019/05/06 15:30:15 +995 [notice] active:0,rel:3,obs del:0,tw:0
2019/05/06 15:30:15 +995 [notice] conns:0,resp:0,c-resp:0
2019/05/06 15:30:15 +995 [notice] resp fin:0,resp rst:0
2019/05/06 15:30:15 +995 [notice] send:6,send content:0
2019/05/06 15:30:15 +995 [notice] send syn:3, fin:0,reset:3
2019/05/06 15:30:15 +995 [notice] reconnect:0,for no syn:0
2019/05/06 15:30:15 +995 [notice] retransmit:0
2019/05/06 15:30:15 +995 [notice] recv packs after retransmission:0
2019/05/06 15:30:15 +995 [notice] syn cnt:3,all clt:15,clt cont:3
2019/05/06 15:30:15 +995 [notice] total cont retransmit:0, frag:0
2019/05/06 15:30:15 +995 [notice] total captured packets:41005
2019/05/06 15:30:45 +999 [notice] user time used:0
2019/05/06 15:30:45 +999 [notice] sys  time used:0
2019/05/06 15:30:45 +999 [notice] max memory size:4200
2019/05/06 15:30:45 +999 [notice] Total allocated space (bytes): 53680
2019/05/06 15:30:45 +999 [notice] Total free space (bytes): 81488
2019/05/06 15:30:45 +999 [notice] Top-most, releasable space (bytes): 81008
2019/05/06 15:30:45 +999 [notice] active:0,rel:3,obs del:0,tw:0
2019/05/06 15:30:45 +999 [notice] conns:0,resp:0,c-resp:0
2019/05/06 15:30:45 +999 [notice] resp fin:0,resp rst:0
2019/05/06 15:30:45 +999 [notice] send:6,send content:0
2019/05/06 15:30:45 +999 [notice] send syn:3, fin:0,reset:3
2019/05/06 15:30:45 +999 [notice] reconnect:0,for no syn:0
2019/05/06 15:30:45 +999 [notice] retransmit:0
2019/05/06 15:30:45 +999 [notice] recv packs after retransmission:0
2019/05/06 15:30:45 +999 [notice] syn cnt:3,all clt:15,clt cont:3
2019/05/06 15:30:45 +999 [notice] total cont retransmit:0, frag:0
2019/05/06 15:30:45 +999 [notice] total captured packets:82960
2019/05/06 15:31:15 +999 [notice] active:0,rel:3,obs del:0,tw:0
2019/05/06 15:31:15 +999 [notice] conns:0,resp:0,c-resp:0
2019/05/06 15:31:15 +999 [notice] resp fin:0,resp rst:0
2019/05/06 15:31:15 +999 [notice] send:6,send content:0
2019/05/06 15:31:15 +999 [notice] send syn:3, fin:0,reset:3
2019/05/06 15:31:15 +999 [notice] reconnect:0,for no syn:0
2019/05/06 15:31:15 +999 [notice] retransmit:0
2019/05/06 15:31:15 +999 [notice] recv packs after retransmission:0
2019/05/06 15:31:15 +999 [notice] syn cnt:3,all clt:15,clt cont:3
2019/05/06 15:31:15 +999 [notice] total cont retransmit:0, frag:0
2019/05/06 15:31:15 +999 [notice] total captured packets:124987
2019/05/06 15:31:45 +999 [notice] user time used:0
2019/05/06 15:31:45 +999 [notice] sys  time used:0
2019/05/06 15:31:45 +999 [notice] max memory size:4200
2019/05/06 15:31:45 +999 [notice] Total allocated space (bytes): 53680
2019/05/06 15:31:45 +999 [notice] Total free space (bytes): 81488
2019/05/06 15:31:45 +999 [notice] Top-most, releasable space (bytes): 81008
2019/05/06 15:31:45 +999 [notice] active:0,rel:3,obs del:0,tw:0
2019/05/06 15:31:45 +999 [notice] conns:0,resp:0,c-resp:0
2019/05/06 15:31:45 +999 [notice] resp fin:0,resp rst:0
2019/05/06 15:31:45 +999 [notice] send:6,send content:0
2019/05/06 15:31:45 +999 [notice] send syn:3, fin:0,reset:3
2019/05/06 15:31:45 +999 [notice] reconnect:0,for no syn:0
2019/05/06 15:31:45 +999 [notice] retransmit:0
2019/05/06 15:31:45 +999 [notice] recv packs after retransmission:0
2019/05/06 15:31:45 +999 [notice] syn cnt:3,all clt:15,clt cont:3
2019/05/06 15:31:45 +999 [notice] total cont retransmit:0, frag:0
2019/05/06 15:31:45 +999 [notice] total captured packets:168439

3. 在线服务器 tcpdump 抓包信息
[root@onlineserver ~]# tcpdump -i eth0 dst host 116.32.pb.ip 
15:30:03.284115 IP um1.55051 > 116.32.pb.ip.febooti-aw: Flags [P.], seq 2960952004:2960952018, ack 3357128608, win 58, options [nop,nop,TS val 1302601059 ecr 2527458587], length 14
15:30:03.284163 IP 10.1.2.1.apc-2160 > 116.32.pb.ip.6677: Flags [S], seq 3598732489, win 17680, options [mss 1356,nop,wscale 8,nop,nop,sackOK], length 0
15:30:05.449118 IP um1.55053 > 116.32.pb.ip.febooti-aw: Flags [P.], seq 4278567189:4278567203, ack 1852846293, win 58, options [nop,nop,TS val 1302603224 ecr 2527458649], length 14
15:30:05.449156 IP 10.1.2.1.apc-2161 > 116.32.pb.ip.6677: Flags [S], seq 3314619336, win 17680, options [mss 1356,nop,wscale 8,nop,nop,sackOK], length 0
15:30:06.264166 IP um1.55051 > 116.32.pb.ip.febooti-aw: Flags [P.], seq 14:28, ack 1, win 58, options [nop,nop,TS val 1302604039 ecr 2527475805], length 14
15:30:06.264207 IP 10.1.2.1.navisphere > 116.32.pb.ip.6677: Flags [S], seq 2501730870, win 17680, options [mss 1356,nop,wscale 8,nop,nop,sackOK], length 0
15:30:06.294091 IP 10.1.2.1.apc-2160 > 116.32.pb.ip.6677: Flags [R.], seq 3598732490, ack 0, win 65535, length 0
15:30:08.458109 IP 10.1.2.1.apc-2161 > 116.32.pb.ip.6677: Flags [R.], seq 3314619337, ack 0, win 65535, length 0
15:30:09.270082 IP 10.1.2.1.navisphere > 116.32.pb.ip.6677: Flags [R.], seq 2501730871, ack 0, win 65535, length 0

4. intercept服务抓包
[root@testserver ~]# tcpdump -i ens192 port 36524
tcpdump: verbose output suppressed, use -v or -vv for full protocol decode
listening on ens192, link-type EN10MB (Ethernet), capture size 262144 bytes
15:42:54.697985 IP 172.16.2.1.12268 > 10.1.2.135.febooti-aw: Flags [P.], seq 4278567217:4278567231, ack 1852846293, win 58, options [nop,nop,TS val 1303372444 ecr 2528229385], length 14
15:42:54.698009 IP 10.1.2.135.febooti-aw > 172.16.2.1.12268: Flags [.], ack 14, win 227, options [nop,nop,TS val 2528247191 ecr 1303372444], length 0
15:43:00.312407 IP 172.16.2.1.12267 > 10.1.2.135.febooti-aw: Flags [P.], seq 2960952046:2960952060, ack 3357128608, win 58, options [nop,nop,TS val 1303378059 ecr 2528230947], length 14
15:43:00.312452 IP 10.1.2.135.febooti-aw > 172.16.2.1.12267: Flags [.], ack 14, win 227, options [nop,nop,TS val 2528252805 ecr 1303378059], length 0

5. 测试服务抓包
[root@testserver ~]# tcpdump -i ens192 port 6677 没有任何信息

6. 
	开始，测试服务与intercept服务分开部署，后面合并到一台服务器。
	a. 在阿里云上测试访问内网服务 curl 116.32.pb.ip.6677 正常。
	b. 通过日志 syn cnt:3,all clt:15,clt cont:3 显示抓包成功。
	c. 测试服务器 net.ipv4.conf.all.rp_filter=0   net.ipv4.ip_forward=0
	@wangbin579  能给一些建议么？

**Comment by wangbin579** [comment]
估计tcpcopy发送的10.1.3.x的数据包都直接被线上机器的IP层干掉了，在线上机器tcpdump抓包没有看到，建议要么从数据链路层发包（使用比较复杂，不再享受arp服务，mac地址需要自己设置），要么直接利用线上机器IP地址来尝试发送（-c 线上机器IP地址），看看线上机器能否抓到tcpcopy发出去的数据包，后续步骤参考：https://github.com/session-replay-tools/tcpcopy/issues/336

除了上面参考，你还需要注意如下：
环境比较复杂，存在NAT地址转换，建议intercept和tcpcopy configure的时候都加上--dnat以规避DNAT带来的问题。

**Comment by yuyetingqin** [comment]
1. 编译intercept/tcpcopy
./configure --prefix=/opt/tcpcopy --dnat 

public_pc 有公网IP(117.34.public_ip)
dn3 内网服务器(10.1.2.135)，通过防火墙(119.62.pb.ip)端口映射

2. 启动intercept(关闭防火墙、关闭 rp_filter ip_forward, 该机未设置路由)
[root@dn3 ~]# ./intercept -i ens192 -F 'tcp and src port 6677' -d
[root@dn3 ~]# python -m SimpleHTTPServer 6677

3. 启动tcpcopy服务(关闭防火墙、关闭 rp_filter ip_forward)
[root@public_pc sbin]# ./tcpcopy -x 6677-119.62.pb.ip:6677 -s 119.62.pb.ip  -c 117.34.pb.ip -d
[root@public_pc sbin]# python -m SimpleHTTPServer 6677

3. 在线服务tcpdump抓包
[root@public_pc sbin]# tcpdump -i eno1 dst host 119.62.pb.ip
tcpdump: verbose output suppressed, use -v or -vv for full protocol decode
listening on eno1, link-type EN10MB (Ethernet), capture size 262144 bytes
17:37:29.505917 IP 117.34.pb.ip.59681 > 119.62.pb.ip.febooti-aw: Flags [P.], seq 3240894206:3240894220, ack 3564279672, win 58, length 14
17:37:29.505946 IP 117.34.pb.ip.36928 > 119.62.pb.ip.6677: Flags [S], seq 2740768218, win 17680, options [mss 1356,nop,wscale 8,nop,nop,sackOK], length 0
17:37:29.538848 IP 117.34.pb.ip.36928 > 119.62.pb.ip.6677: Flags [R], seq 2740768219, win 0, length 0
17:37:32.507038 IP 117.34.pb.ip.36928 > 119.62.pb.ip.6677: Flags [R.], seq 2740768219, ack 0, win 65535, length 0
17:37:37.370380 IP 117.34.pb.ip.59682 > 119.62.pb.ip.febooti-aw: Flags [P.], seq 2427682453:2427682467, ack 2721710291, win 58, length 14
17:37:37.370419 IP 117.34.pb.ip.36953 > 119.62.pb.ip.6677: Flags [S], seq 2214099568, win 17680, options [mss 1356,nop,wscale 8,nop,nop,sackOK], length 0
17:37:37.403340 IP 117.34.pb.ip.36953 > 119.62.pb.ip.6677: Flags [R], seq 2214099569, win 0, length 0
17:37:40.370710 IP 117.34.pb.ip.36953 > 119.62.pb.ip.6677: Flags [R.], seq 2214099569, ack 0, win 65535, length 0


4. tcpcopy 日志
[root@public_pc sbin]#tail -n100 -f ./logs/error_tcpcopy.log
2019/05/08 17:36:56 +132 [notice] active:0,rel:14,obs del:0,tw:0
2019/05/08 17:36:56 +132 [notice] conns:0,resp:0,c-resp:0
2019/05/08 17:36:56 +132 [notice] resp fin:0,resp rst:0
2019/05/08 17:36:56 +132 [notice] send:28,send content:0
2019/05/08 17:36:56 +132 [notice] send syn:14, fin:0,reset:14
2019/05/08 17:36:56 +132 [notice] reconnect:0,for no syn:0
2019/05/08 17:36:56 +132 [notice] retransmit:0
2019/05/08 17:36:56 +132 [notice] recv packs after retransmission:0
2019/05/08 17:36:56 +132 [notice] syn cnt:14,all clt:92,clt cont:12
2019/05/08 17:36:56 +132 [notice] total cont retransmit:0, frag:328
2019/05/08 17:36:56 +132 [notice] total captured packets:16279
2019/05/08 17:37:26 +127 [notice] user time used:0
2019/05/08 17:37:26 +127 [notice] sys  time used:0
2019/05/08 17:37:26 +127 [notice] max memory size:4020
2019/05/08 17:37:26 +127 [notice] Total allocated space (bytes): 53680
2019/05/08 17:37:26 +127 [notice] Total free space (bytes): 81488
2019/05/08 17:37:26 +127 [notice] Top-most, releasable space (bytes): 81008
2019/05/08 17:37:26 +133 [notice] active:0,rel:14,obs del:0,tw:0
2019/05/08 17:37:26 +133 [notice] conns:0,resp:0,c-resp:0
2019/05/08 17:37:26 +133 [notice] resp fin:0,resp rst:0
2019/05/08 17:37:26 +133 [notice] send:28,send content:0
2019/05/08 17:37:26 +133 [notice] send syn:14, fin:0,reset:14
2019/05/08 17:37:26 +133 [notice] reconnect:0,for no syn:0
2019/05/08 17:37:26 +133 [notice] retransmit:0
2019/05/08 17:37:26 +133 [notice] recv packs after retransmission:0
2019/05/08 17:37:26 +133 [notice] syn cnt:14,all clt:92,clt cont:12
2019/05/08 17:37:26 +133 [notice] total cont retransmit:0, frag:367
2019/05/08 17:37:26 +133 [notice] total captured packets:17519
2019/05/08 17:37:56 +133 [notice] active:0,rel:16,obs del:0,tw:0
2019/05/08 17:37:56 +133 [notice] conns:0,resp:0,c-resp:0
2019/05/08 17:37:56 +133 [notice] resp fin:0,resp rst:0
2019/05/08 17:37:56 +133 [notice] send:32,send content:0
2019/05/08 17:37:56 +133 [notice] send syn:16, fin:0,reset:16
2019/05/08 17:37:56 +133 [notice] reconnect:0,for no syn:0
2019/05/08 17:37:56 +133 [notice] retransmit:0
2019/05/08 17:37:56 +133 [notice] recv packs after retransmission:0
2019/05/08 17:37:56 +133 [notice] syn cnt:16,all clt:106,clt cont:14
2019/05/08 17:37:56 +133 [notice] total cont retransmit:0, frag:392
2019/05/08 17:37:56 +133 [notice] total captured packets:18785
2019/05/08 17:38:26 +128 [notice] user time used:0
2019/05/08 17:38:26 +128 [notice] sys  time used:0
2019/05/08 17:38:26 +128 [notice] max memory size:4020
2019/05/08 17:38:26 +128 [notice] Total allocated space (bytes): 53680
2019/05/08 17:38:26 +128 [notice] Total free space (bytes): 81488
2019/05/08 17:38:26 +128 [notice] Top-most, releasable space (bytes): 81008
2019/05/08 17:38:26 +133 [notice] active:0,rel:16,obs del:0,tw:0
2019/05/08 17:38:26 +133 [notice] conns:0,resp:0,c-resp:0
2019/05/08 17:38:26 +133 [notice] resp fin:0,resp rst:0
2019/05/08 17:38:26 +133 [notice] send:32,send content:0
2019/05/08 17:38:26 +133 [notice] send syn:16, fin:0,reset:16
2019/05/08 17:38:26 +133 [notice] reconnect:0,for no syn:0
2019/05/08 17:38:26 +133 [notice] retransmit:0
2019/05/08 17:38:26 +133 [notice] recv packs after retransmission:0
2019/05/08 17:38:26 +133 [notice] syn cnt:16,all clt:106,clt cont:14
2019/05/08 17:38:26 +133 [notice] total cont retransmit:0, frag:417
2019/05/08 17:38:26 +133 [notice] total captured packets:20051


5. 测试服务器服务端口抓包
[root@dn3 tcpcopy]# tcpdump -i ens192 port 6677
17:37:23.507043 IP 172.16.2.1.14917 > 10.1.2.135.6677: Flags [S], seq 2740768218, win 17680, options [mss 1356,nop,wscale 8,nop,nop,sackOK], length 0
17:37:23.507072 IP 10.1.2.135.6677 > 172.16.2.1.14917: Flags [S.], seq 3015614768, ack 2740768219, win 29200, options [mss 1460,nop,nop,sackOK,nop,wscale 7], length 0
17:37:23.539853 IP 172.16.2.1.14917 > 10.1.2.135.6677: Flags [R], seq 2740768219, win 0, length 0
17:37:31.371265 IP 172.16.2.1.14925 > 10.1.2.135.6677: Flags [S], seq 2214099568, win 17680, options [mss 1356,nop,wscale 8,nop,nop,sackOK], length 0
17:37:31.371287 IP 10.1.2.135.6677 > 172.16.2.1.14925: Flags [S.], seq 2923543692, ack 2214099569, win 29200, options [mss 1460,nop,nop,sackOK,nop,wscale 7], length 0
17:37:31.404218 IP 172.16.2.1.14925 > 10.1.2.135.6677: Flags [R], seq 2214099569, win 0, length 0


6. 测试服务器intercept 端口抓包
[root@dn3 ~]# tcpdump -i ens192 port 36524
tcpdump: verbose output suppressed, use -v or -vv for full protocol decode
listening on ens192, link-type EN10MB (Ethernet), capture size 262144 bytes
17:37:23.506867 IP 172.16.2.1.14245 > 10.1.2.135.febooti-aw: Flags [P.], seq 3240894206:3240894220, ack 3564279672, win 58, length 14
17:37:23.506889 IP 10.1.2.135.febooti-aw > 172.16.2.1.14245: Flags [.], ack 14, win 229, length 0
17:37:31.371195 IP 172.16.2.1.14246 > 10.1.2.135.febooti-aw: Flags [P.], seq 2427682453:2427682467, ack 2721710291, win 58, length 14
17:37:31.371230 IP 10.1.2.135.febooti-aw > 172.16.2.1.14246: Flags [.], ack 14, win 229, length 0

@wangbin579  这次换了一个公网主机，以及参考之前的帖子的注意事项，并在编译时加了 --dnat  。这次在测试服务器上可以抓到握手信息，但是没有数据包，也关闭了测试服务器上的 rp_filter、防火墙等。还是不能收到转发来的消息。
