### ISSUE TITLE
target svr对于丢弃tcpcopy的第一次握手的SYNC包

### ISSUE THREAD

**Issue by qingping209** [session-replay-tools/tcpcopy#320]
我在tcpcopy所在的机器上面抓到了很多rst包， 这些rst包的src host是改写后的，所以不是客户端发生发过来的。 有几个事实：
1.  tcpcopy所在的机器上面有很多客户端连接， 大于20000
2.   rst包的src host是被改写过的， dst host是copy的目的地址

**Comment by lazio579** [comment]
这个需要抓包分析的，得有抓包数据才能分析

**Comment by qingping209** [comment]
我运行tcpcopy的时候，制定了-c 结尾为a.b.c.x,， 但是实际抓包的时候， 只看到src host为a.b.c.y, y = 【1， 8】的包。  这个符合预期么？
我没有深入看代码，  不过我在想，对于每个被copy的会话， tcpcopy会为创建一个状态， tcpcopy伪装为真实的src host，把属于该会话的包进行修改，然后发到target svr， target接受这些包， 并试图回包， 回的包被修改过的路由规则转到assist svr， assist svr把这些来自target svr的包，做处理，然后发给tcpcopy。 

如果要对每个session维护一个状态， 那么就要保证修改的(host, ip)组合足够用，不然的话可能发生冲突， 也就是说，来自不同的会话的包，在经过tcpcopy的修改以后， 拥有共同的(src host, src ip)。

**Comment by lazio579** [comment]
理解挺到位的。

tcpcopy发送rst数据包，原因是很多的，具体问题需要具体分析：
候选原因：
1）超时，得不到服务器端的响应
2）由于延迟或者其它方面的原因，堆积的数据包太多，来不及处理，为了确保内存不至于占用过多，就发送reset
3）由于tcpcopy抓包环节丢包，那么这个时候，会话无法继续回放，则数据包个数会堆积到一定程度，导致会话自杀

**Comment by qingping209** [comment]
多谢回复 👍 

我运行tcpcopy的时候，制定了-c 结尾为a.b.c.x,， 但是实际抓包的时候， 只看到src host为**a.b.c.y, y = [1-8]** 的包。 这个符合预期么？ 

 开debug看到如下日志：

2018/03/26 17:36:16 +118 [info] sess key:5499460553614, check timeout:36491
2018/03/26 17:36:16 +118 [info] est timeout, state:1, p:36491
2018/03/26 17:36:16 +118 [debug] sess post disp:36491
2018/03/26 17:36:16 +118 [debug] send passive rst:36491
2018/03/26 17:36:16 +118 [debug] to bak:**rewritten src ip:36491**-->**target svr ip:target svr port**,len 40,seq=2744552854,ack=0
2018/03/26 17:36:16 +118 [info] req unsend:36491,syn seq:2744552853,max:2744552952

对比了一下代码，看起来是tcpcopy发送了SYNC包以后， 由于某种原因， 造成了超时么？

进一步抓包， 看到如下交互:

17:53:13.120503 IP original-client-ip.55177 > online-svr-ip.50019: Flags [P.], seq 2683076855:2683076932, ack 3522926543, win 501, options [nop,nop,TS val 2480179157 ecr 238834829], length 77
17:53:13.120565 IP rewritten-client-ip.55177 > target-svr-ip.50003: Flags [S], seq 2683076854, win 65535, options [mss 1460], length 0
17:53:13.123280 IP original-client-ip.55177 > online-svr-ip.50019: Flags [.], ack 13, win 501, options [nop,nop,TS val 2480179158 ecr 238903708], length 0
17:53:14.786698 IP original-client-ip.55177 > online-svr-ip.50019: Flags [P.], seq 77:175, ack 13, win 501, options [nop,nop,TS val 2480179574 ecr 238903708], length 98
17:53:14.789619 IP original-client-ip.55177 > online-svr-ip.50019: Flags [.], ack 18, win 501, options [nop,nop,TS val 2480179575 ecr 238904124], length 0
17:53:16.120251 IP rewritten-client-ip.55177 > target-svr-ip.50003: Flags [R.], seq 2683076855, ack 0, win 65535, length 0
17:53:17.182494 IP original-client-ip.55177 > online-svr-ip.50019: Flags [P.], seq 175:273, ack 18, win 501, options [nop,nop,TS val 2480180173 ecr 238904124], length 98
17:53:17.185391 IP original-client-ip.55177 > online-svr-ip.50019: Flags [.], ack 23, win 501, options [nop,nop,TS val 2480180174 ecr 238904723], length 0
17:53:18.973514 IP original-client-ip.55177 > online-svr-ip.50019: Flags [P.], seq 273:367, ack 23, win 501, options [nop,nop,TS val 2480180621 ecr 238904723], length 94
17:53:18.973558 IP rewritten-client-ip.55177 > target-svr-ip.50003: Flags [S], seq 2683077127, win 65535, options [mss 1460], length 0
17:53:18.976187 IP original-client-ip.55177 > online-svr-ip.50019: Flags [.], ack 28, win 501, options [nop,nop,TS val 2480180621 ecr 238905171], length 0
17:53:21.282487 IP original-client-ip.55177 > online-svr-ip.50019: Flags [.], seq 367:1815, ack 28, win 501, options [nop,nop,TS val 2480181198 ecr 238905171], length 1448
17:53:21.282499 IP original-client-ip.55177 > online-svr-ip.50019: Flags [.], seq 1815:3263, ack 28, win 501, options [nop,nop,TS val 2480181198 ecr 238905171], length 1448
17:53:21.282513 IP original-client-ip.55177 > online-svr-ip.50019: Flags [.], seq 3263:4711, ack 28, win 501, options [nop,nop,TS val 2480181198 ecr 238905171], length 1448
17:53:21.282530 IP original-client-ip.55177 > online-svr-ip.50019: Flags [.], seq 4711:6159, ack 28, win 501, options [nop,nop,TS val 2480181198 ecr 238905171], length 1448
17:53:21.282548 IP original-client-ip.55177 > online-svr-ip.50019: Flags [P.], seq 6159:7702, ack 28, win 501, options [nop,nop,TS val 2480181198 ecr 238905171], length 1543
17:53:21.285401 IP original-client-ip.55177 > online-svr-ip.50019: Flags [.], ack 33, win 501, options [nop,nop,TS val 2480181199 ecr 238905748], length 0
17:53:21.285498 IP original-client-ip.55177 > online-svr-ip.50019: Flags [.], ack 48, win 501, options [nop,nop,TS val 2480181199 ecr 238905748], length 0
17:53:21.285602 IP original-client-ip.55177 > online-svr-ip.50019: Flags [.], ack 283, win 500, options [nop,nop,TS val 2480181199 ecr 238905748], length 0
17:53:21.973068 IP rewritten-client-ip.55177 > target-svr-ip.50003: Flags [R.], seq 273, ack 1, win 65535, length 0
17:53:22.762820 IP original-client-ip.55177 > online-svr-ip.50019: Flags [P.], seq 7702:7782, ack 283, win 501, options [nop,nop,TS val 2480181568 ecr 238905748], length 80
17:53:22.766052 IP original-client-ip.55177 > online-svr-ip.50019: Flags [.], ack 337, win 501, options [nop,nop,TS val 2480181569 ecr 238906118], length 0

也就是说tcpcopy在给target svr发了一个SYNC包的3秒钟以后，给target svr发了一个RST包

PS:  我是把tcpcopy和intercept部署在同一个机器上面。

**Comment by lazio579** [comment]
est timeout，就代表tcpcopy没有收到第二次握手数据包，最好在测试机器抓包，看看是否回复了第二次握手数据包，如果回复了，那可能是intercept过滤条件没有搞好。

btw，a.b.c.y，按道理，y值会从1～254中取

**Comment by qingping209** [comment]
在测试机抓包了，测试机器没有回复SYNC.

**Comment by lazio579** [comment]
那得在tcp层面，为啥测试机器没有回复第二次握手数据包了，如果有大量SYN_RECV状态，说明到tcp层了，如果没有，那就说明在ip层就干掉其中的很多第一次握手数据包了

**Comment by qingping209** [comment]
还真没有， 
![image](https://user-images.githubusercontent.com/11344292/37901246-4246ad90-3123-11e8-874e-dac40f11ab71.png)

**Comment by qingping209** [comment]
@lazio579 我看tcpcopy断开连接的方式都是直接发RST.啊， 并没有使用fin包么？ 还有，target svr把SYNC包丢弃了之后， tcpcopy就不再重传， 而是直接发一个RST？

**Comment by lazio579** [comment]
tcpcopy发送了第一次握手数据包，如果3s内没有收到第二次握手数据包，则3s超时，会发送rst数据包的。

rst数据包，更加简单粗暴，可以规避一大堆tcp状态的问题

目前tcpcopy对于syn数据包没有重传，其它带有payload的数据包是有的。

**Comment by lazio579** [comment]
伪造syn包，尝试重建连接，如果有认证信息，要么参考mysql replay过程（ https://github.com/session-replay-tools/mysql-replay-module ）二次开发，要么去掉认证过程，才能继续

**Comment by qingping209** [comment]
嗯。 我去掉了认证逻辑， 已经愉快了跑了好几天了。
