### ISSUE TITLE
没有接收到包

### ISSUE THREAD

**Issue by weihaitong** [session-replay-tools/tcpcopy#233]
你好。
我下载最新版本导流，发现目标设备没有收到，不得其解，特来求解。
环境是这样的。
目标设备：60.210.10.47 (websvr)
辅助设备：60.210.10.80 (intercept version:1.0.0)
线上设备：14.18.142.159 (websvr) tcpcopy version:1.0.0
配置如下：
线上设备：./tcpcopy -x 80-60.210.10.47:80 -s 60.210.10.80 -c 60.210.10.111 -d
辅助设备：/usr/local/intercept/sbin/intercept -i bond0 -F 'tcp and src port 80' -d
目标设备：route add -host 60.210.10.111 gw 60.210.10.80

然后我分别在线上设备和目标设备抓包：
线上设备：tcpdump -n -i eth0 port 80 and dst host 60.210.10.47
发现有发包：（没有回来的包）
17:37:54.752680 IP 60.210.10.111.49182 > 60.210.10.47.http: Flags [S], seq 2788521748, win 65535, options [mss 1460], length 0
17:37:54.766145 IP 60.210.10.111.65505 > 60.210.10.47.http: Flags [S], seq 1564634615, win 65535, options [mss 1460], length 0
17:37:54.777934 IP 60.210.10.111.51275 > 60.210.10.47.http: Flags [R.], seq 1184151881, ack 0, win 65535, length 0
17:37:54.797926 IP 60.210.10.111.4144 > 60.210.10.47.http: Flags [S], seq 3113268547, win 14600, options [mss 1360], length 0

但是在目标设备抓包：cpdump -i eth0 port 80 and src host 60.210.10.111 -s0
发现没有包到达。
防火墙都关闭了。

请问我哪里弄错了？

**Comment by wangbin579** [comment]
14.18.142.159和60.210.10.47在同一个网段吗？
首先从你的描述来看，是目标机器抓不到包，说明没有通过目标机器的数据链路层，因此跟iptables（工作在ip层）等设置没有关系了。

其次，从14.18.142.159所在的机器是能出去的，但没有能够到达目标机器，说明数据包在路途过程中应该就被干掉了，有如下方法可以操作：
1）通过-c换个靠谱的ip，使其能够通过所有设备
2）采用vpn
3）代理过去
4）离线回放，在线上抓包下来，然后在目标机器回放，避开跨网段等类似的问题

**Comment by weihaitong** [comment]
谢谢即时答复。
14.18.142.159和60.210.10.47 不在同一个网段。我阅读你的blog，目标设备和线上设备不必在同一网段的。
各个设备的iptables都stop了。

**Comment by wangbin579** [comment]
网络是很复杂的，路途过程中的交换机或者路由器（甚至虚拟机），都有可能存在anti-spoof的检测的，尤其是跨运营商。
目前的情况，目标机器和线上机器，其iptables设置跟你的问题无关。
还有即使能够到ip层，不仅仅iptables会干涉。
