### ISSUE TITLE
mysql 模式不成功

### ISSUE THREAD

**Issue by kafkaGTS** [session-replay-tools/tcpcopy#277]
线上机A：**172.31.60.190**
测试机B：**172.31.57.22**
辅助机使用测试机自身
确定A和B在同网段，均为AWS机器，无法设置路由的，所以辅助机用B自身

A在编译的时候用了
**./configure --set-protocol-module=mysql-sgt-replay-module**
并且都没报错

在B上运行：(**B上面的mysql端口为8066**)
**./intercept -i eth0 -F 'tcp and src port 8066' -d**

在A上运行：
**./tcpcopy -x 3306-172.31.57.22:8066 -s 172.31.57.22 -l tcpcopy.log -c 10.10.10.x -d**

然后随便发了5个请求到A试一下：
A上用**tcpdump**查看的日志如下：
[root@ip-172-31-60-190 etc]# /usr/local/sbin/./tcpdump host 172.31.57.22
tcpdump: verbose output suppressed, use -v or -vv for full protocol decode
listening on eth0, link-type EN10MB (Ethernet), capture size 65535 bytes
07:02:17.389858 IP ip-172-31-60-190.ec2.internal.28414 > ip-172-31-57-22.ec2.internal.36524: Flags [P.], seq 1536796511:1536796525, ack 3798053965, win 35, options [nop,nop,TS val 3039824529 ecr 1146498072], length 14
07:02:17.389884 IP ip-172-31-30-28.ec2.internal.47760 > ip-172-31-57-22.ec2.internal.8066: Flags [S], seq 1104740491, win 26883, options [mss 8961,sackOK,TS val 2853047975 ecr 0,nop,wscale 7], length 0
07:02:17.390208 IP ip-172-31-57-22.ec2.internal.36524 > ip-172-31-60-190.ec2.internal.28414: Flags [.], ack 14, win 35, options [nop,nop,TS val 1146661176 ecr 3039824529], length 0
07:02:17.525533 IP ip-172-31-60-190.ec2.internal.28413 > ip-172-31-57-22.ec2.internal.36524: Flags [P.], seq 595742906:595742920, ack 1993136808, win 35, options [nop,nop,TS val 3039824665 ecr 1146498078], length 14
07:02:17.525554 IP ip-172-31-30-28.ec2.internal.47762 > ip-172-31-57-22.ec2.internal.8066: Flags [S], seq 729046063, win 26883, options [mss 8961,sackOK,TS val 2853048111 ecr 0,nop,wscale 7], length 0
07:02:17.525849 IP ip-172-31-57-22.ec2.internal.36524 > ip-172-31-60-190.ec2.internal.28413: Flags [.], ack 14, win 35, options [nop,nop,TS val 1146661311 ecr 3039824665], length 0
07:02:17.538495 IP ip-172-31-60-190.ec2.internal.28414 > ip-172-31-57-22.ec2.internal.36524: Flags [P.], seq 14:28, ack 1, win 35, options [nop,nop,TS val 3039824678 ecr 1146661176], length 14
07:02:17.538514 IP ip-172-31-30-28.ec2.internal.47764 > ip-172-31-57-22.ec2.internal.8066: Flags [S], seq 1052776959, win 26883, options [mss 8961,sackOK,TS val 2853048124 ecr 0,nop,wscale 7], length 0
07:02:17.538780 IP ip-172-31-57-22.ec2.internal.36524 > ip-172-31-60-190.ec2.internal.28414: Flags [.], ack 28, win 35, options [nop,nop,TS val 1146661324 ecr 3039824678], length 0
07:02:17.548357 IP ip-172-31-60-190.ec2.internal.28413 > ip-172-31-57-22.ec2.internal.36524: Flags [P.], seq 14:28, ack 1, win 35, options [nop,nop,TS val 3039824688 ecr 1146661311], length 14
07:02:17.548377 IP ip-172-31-30-28.ec2.internal.47766 > ip-172-31-57-22.ec2.internal.8066: Flags [S], seq 3903931001, win 26883, options [mss 8961,sackOK,TS val 2853048134 ecr 0,nop,wscale 7], length 0
07:02:17.548651 IP ip-172-31-57-22.ec2.internal.36524 > ip-172-31-60-190.ec2.internal.28413: Flags [.], ack 28, win 35, options [nop,nop,TS val 1146661334 ecr 3039824688], length 0
07:02:17.557446 IP ip-172-31-60-190.ec2.internal.28414 > ip-172-31-57-22.ec2.internal.36524: Flags [P.], seq 28:42, ack 1, win 35, options [nop,nop,TS val 3039824697 ecr 1146661324], length 14
07:02:17.557464 IP ip-172-31-30-28.ec2.internal.47768 > ip-172-31-57-22.ec2.internal.8066: Flags [S], seq 3308384408, win 26883, options [mss 8961,sackOK,TS val 2853048143 ecr 0,nop,wscale 7], length 0
07:02:17.557698 IP ip-172-31-57-22.ec2.internal.36524 > ip-172-31-60-190.ec2.internal.28414: Flags [.], ack 42, win 35, options [nop,nop,TS val 1146661343 ecr 3039824697], length 0
07:02:20.390062 IP ip-172-31-30-28.ec2.internal.47760 > ip-172-31-57-22.ec2.internal.8066: Flags [R.], seq 1104740492, ack 0, win 65535, length 0
07:02:20.525313 IP ip-172-31-30-28.ec2.internal.47762 > ip-172-31-57-22.ec2.internal.8066: Flags [R.], seq 729046064, ack 0, win 65535, length 0
07:02:20.538456 IP ip-172-31-30-28.ec2.internal.47764 > ip-172-31-57-22.ec2.internal.8066: Flags [R.], seq 1052776960, ack 0, win 65535, length 0
07:02:20.548591 IP ip-172-31-30-28.ec2.internal.47766 > ip-172-31-57-22.ec2.internal.8066: Flags [R.], seq 3903931002, ack 0, win 65535, length 0
07:02:20.557729 IP ip-172-31-30-28.ec2.internal.47768 > ip-172-31-57-22.ec2.internal.8066: Flags [R.], seq 3308384409, ack 0, win 65535, length 0

A上的**Tcpcopy**日志如下：
2017/02/14 07:03:00 +369 [notice] Top-most, releasable space (bytes): 133904
2017/02/14 07:03:00 +377 [notice] active:0,rel:228,obs del:0,tw:0
2017/02/14 07:03:00 +377 [notice] conns:0,resp:0,c-resp:0
2017/02/14 07:03:00 +377 [notice] resp fin:0,resp rst:0
2017/02/14 07:03:00 +377 [notice] send:456,send content:0
2017/02/14 07:03:00 +377 [notice] send syn:228, fin:0,reset:228
2017/02/14 07:03:00 +377 [notice] reconnect:0,for no syn:0
2017/02/14 07:03:00 +377 [notice] retransmit:0
2017/02/14 07:03:00 +377 [notice] recv packs after retransmission:0
2017/02/14 07:03:00 +377 [notice] syn cnt:228,all clt:2783,clt cont:1546
2017/02/14 07:03:00 +377 [notice] total cont retransmit:0, frag:2
2017/02/14 07:03:00 +377 [notice] total captured packets:4145
2017/02/14 07:03:30 +378 [notice] active:0,rel:228,obs del:0,tw:0
2017/02/14 07:03:30 +378 [notice] conns:0,resp:0,c-resp:0
2017/02/14 07:03:30 +378 [notice] resp fin:0,resp rst:0
2017/02/14 07:03:30 +378 [notice] send:456,send content:0
2017/02/14 07:03:30 +378 [notice] send syn:228, fin:0,reset:228
2017/02/14 07:03:30 +378 [notice] reconnect:0,for no syn:0
2017/02/14 07:03:30 +378 [notice] retransmit:0
2017/02/14 07:03:30 +378 [notice] recv packs after retransmission:0
2017/02/14 07:03:30 +378 [notice] syn cnt:228,all clt:2783,clt cont:1546
2017/02/14 07:03:30 +378 [notice] total cont retransmit:0, frag:2
2017/02/14 07:03:30 +378 [notice] total captured packets:4148

看了很多帖子提到的问题，感觉都没有问题
ip_forward=1
mysql 配置了 skip-grant-tables

**Comment by wangbin579** [comment]
要分析此问题，需要分析测试服务器的抓包情况，看看第一次握手数据包到了测试服务器没有？

**Comment by wangbin579** [comment]
采用-c 10.10.10.x，看看这些ip地址的数据包能不能到达测试服务器，如果都不能到达，回放必然失败。
如果确实不能抓到syn数据包，可以尝试改变-c参数，最极端的情况就是采用tcpcopy所在机器的ip地址，这样会容易到达测试服务器

**Comment by kafkaGTS** [comment]
@wangbin579  验证了很久，
在线上A机，发现10.10.10.x是有发出去的
在测试B机，发现没有10.10.10.x过来，
通常这样是怎么导致的呢？
因为我们确认了很多配置，他们是在同网段、关闭了防火墙、ip_forward=1、 
难道亚马逊aws机器有你提到的黑洞？

**Comment by wangbin579** [comment]
用tcpcopy所在的机器ip地址来设置-c参数，不就可以验证了吗？

**Comment by kafkaGTS** [comment]
这么做的话，很难区分是 源ip的请求，还是修改后的-c ip请求……
如果tcpcopy机器为A，测试机为B，-c地址为C
用tcpdump的host过滤
如果-c地址为C，那么在B上理论应该可以tcpdump到A和C的tcp包（A少，C多），目前得到只有A没有C
如果-c地址为A，那么现在B上tcpdump到大量A的tcp包，区别不出是A的还是-c过来的
不知道这样说对不对？

**Comment by wangbin579** [comment]
想要验证有没有安全过滤，最妥的方法就是-c tcpcopy所在机器的ip地址，如果syn包能过去，而采用其它ip地址过不去，那基本可以判断有安全过滤了

**Comment by kafkaGTS** [comment]
@wangbin579   非常感谢指导
这下真的确定了…… -c tcpcopy的ip能tcpdump到syn包过来，而其他任何ip都没有，不知所措..
