### ISSUE TITLE
如何使用tcpburn模拟长连接？

### ISSUE THREAD

**Issue by ystyleb** [session-replay-tools/tcpcopy#201]
版本号 tcpburn 1.0.0  intercept 1.0.0 
内核版本号  2.6.32.12
安装规则 ./configure --single
启动命令 ./intercept -i eth1 -F 'tcp and  port 8080' -d
./tcpburn -x 8080-10.240.112.28:8080 -f ./8080.pcap -s 10.240.112.28 -u 50 -c 10.135.200.x
route设置 intercept跟待测服务部署在同一台机器上
日志打印
intercept：
2015/04/07 21:11:20 +240 [notice] it adds fd:7
2015/04/07 21:11:20 +240 [info] malloc memory for fd:7
2015/04/07 21:11:20 +243 [notice] it adds fd:8
2015/04/07 21:11:20 +243 [info] malloc memory for fd:8
2015/04/07 21:11:33 +083 [notice] total resp packs:5575, all:5575, route:0, sock write cnt:4916
2015/04/07 21:12:03 +085 [notice] total resp packs:17988, all:17988, route:0, sock write cnt:16292
2015/04/07 21:12:20 +511 [notice] it adds fd:9
2015/04/07 21:12:20 +511 [warn] it does not support distributed clients
2015/04/07 21:12:20 +511 [notice] release tunnel resources, fd:7
2015/04/07 21:12:20 +511 [notice] enter tc_event_destroy:7
2015/04/07 21:12:20 +511 [notice] delayed destroy ev:7
2015/04/07 21:12:20 +511 [notice] release tunnel resources, fd:8
2015/04/07 21:12:20 +511 [notice] enter tc_event_destroy:8
2015/04/07 21:12:20 +511 [notice] delayed destroy ev:8
2015/04/07 21:12:20 +511 [info] malloc memory for fd:9
2015/04/07 21:12:20 +513 [notice] it adds fd:7
2015/04/07 21:12:20 +513 [info] malloc memory for fd:7
2015/04/07 21:12:33 +085 [notice] total resp packs:30757, all:30757, route:0, sock write cnt:27812
2015/04/07 21:13:03 +087 [notice] total resp packs:43271, all:43271, route:0, sock write cnt:39334
tcpburn：
2015/04/07 21:21:56 +660 [notice] tcpburn version:1.0.0
2015/04/07 21:21:56 +660 [notice] target:8080-10.240.112.28:8080
2015/04/07 21:21:56 +660 [notice] pcap version:libpcap version 1.7.2
2015/04/07 21:21:56 +660 [notice] TC_SINGLE mode
2015/04/07 21:21:56 +660 [notice] keepalive timeout:75
2015/04/07 21:21:56 +660 [notice] set global port for tcpburn
2015/04/07 21:21:56 +660 [notice] client ips:10.135.200.x
2015/04/07 21:21:56 +660 [notice] parallel connections per target:2
2015/04/07 21:21:56 +660 [notice] throughput factor:1,accelerate:1
2015/04/07 21:21:56 +660 [notice] init connections speed:1024
2015/04/07 21:21:56 +660 [notice] s parameter:10.240.112.28
2015/04/07 21:21:56 +660 [notice] set only ip for burn
2015/04/07 21:21:56 +660 [info] connect to remote server(10.240.112.28:36524)
2015/04/07 21:21:56 +660 [info] connect to remote server(10.240.112.28:36524)
2015/04/07 21:21:56 +660 [notice] read over from file:./8080.pcap
2015/04/07 21:21:56 +660 [notice] pool size:536
2015/04/07 21:21:56 +660 [notice] stop, null from pcap_next
2015/04/07 21:21:56 +660 [info] total packets: 8, clt packets:4
2015/04/07 21:21:56 +660 [notice] pool used:536
2015/04/07 21:21:56 +660 [info] enter tc_build_users

测试服务器抓包结果：没有数据包发过来

错误描述
抓包：链接建立后sleep100秒然后断开链接 用wireshark查看抓包文件也是正常的
1	0.000000	10.12.22.200	10.240.112.28	TCP	74	38605→8080 [SYN] Seq=0 Win=5840 Len=0 MSS=1404 SACK_PERM=1 TSval=3910230192 TSecr=0 WS=128
2	0.000022	10.240.112.28	10.12.22.200	TCP	74	8080→38605 [SYN, ACK] Seq=0 Ack=1 Win=5792 Len=0 MSS=1460 SACK_PERM=1 TSval=2666447428 TSecr=3910230192 WS=128
3	0.004089	10.12.22.200	10.240.112.28	TCP	66	38605→8080 [ACK] Seq=1 Ack=1 Win=5888 Len=0 TSval=3910230193 TSecr=2666447428
4	100.002154	10.12.22.200	10.240.112.28	TCP	66	38605→8080 [FIN, ACK] Seq=1 Ack=1 Win=5888 Len=0 TSval=3910255193 TSecr=2666447428
5	100.002170	10.240.112.28	10.12.22.200	TCP	66	8080→38605 [ACK] Seq=1 Ack=2 Win=5888 Len=0 TSval=2666472429 TSecr=3910255193
6	100.002177	10.240.112.28	10.12.22.200	TCP	66	8080→38605 [FIN, ACK] Seq=1 Ack=2 Win=5888 Len=0 TSval=2666472429 TSecr=3910255193
7	100.006256	10.12.22.200	10.240.112.28	TCP	66	38605→8080 [ACK] Seq=2 Ack=2 Win=5888 Len=0 TSval=3910255194 TSecr=2666472429
8	100.006268	10.240.112.28	10.12.22.200	TCP	54	8080→38605 [RST] Seq=2 Win=0 Len=0

**Comment by wangbin579** [comment]
对于tcpburn模拟长连接，需要注意如下两点：
1）configure的时候：
if 根据pcap来回放
  ./configure --single 
else if模拟长连接（comet类型应用）
  ./configure --single --comet  
endif

2）pcap文件，不含有应用层数据的session会被tcpburn过滤掉

**Comment by ystyleb** [comment]
明白了 感谢wangbin
