### ISSUE TITLE
tcpcopy在交换机镜像下的数据获取问题

### ISSUE THREAD

**Issue by wenjq** [session-replay-tools/tcpcopy#206]
我用的0.9.6版本，在局域网有A\B\C\D四台机器，在A、B机上做了交换机镜像，A为被监控机，B为监控机；并在B机上部署了tcpcopy，在D机上部署了intercept。现在A机向C机上发tcp报文，在B机可以用tcpdump可以获取到报文，但是我用tcpcopy pcap方式想从B机将流量引到D机上去，没有成功，请问我这样做是否可行；如果可行，应该使用什么样的参数才能成功

**Comment by lazio579** [comment]
只要tcpdump能够捕获到请求报文，只要命令合适，就可以采用tcpcopy pcap捕获到请求并转发给目标机器。

没有成功，原因可能有很多种，由于没有详细信息，无法诊断。

**Comment by wenjq** [comment]
补充下，我换了下方式，具体信息如下
A机 10.10.73.A  端口镜像被监控机
B机 10.10.73.B   端口镜像监控机 tcpcopy机
C机 10.10.73.C   在线应用服务机  应用端口20007
D机 10.10.73.D  intercept机
E机 10.10.73.E   测试应用服务机 应用端口20017
tcpcopy 安装模式  ./configure --enable-advanced --enable-pcap
D机  ./intercept -F 'port 20017'  -l intercept.log 
         iptables -t filter -I OUTPUT -p tcp --sport 20007 -j QUEUE
         iptables -t filter -I OUTPUT -p tcp --sport 20017 -j QUEUE
E机 route add -net 192.168.100.0 netmask 255.255.255.0 gw 10.10.73.D
B机 ./tcpcopy -x 20007-10.10.73.E:20017 -F 'host 10.10.73.C' -s 10.10.73.D -c 192.168.100.0 

我在B机上使用tcpdump host 10.10.73.C -i any -s 0 -w 1.cap 抓不到包
         使用tcpdump host 10.10.73.C -w 1.cap可以抓到通信内容
但是tcpcopy获取不到通信内容
 我用netstat 在 B机和E机上看，看不到任何关于tcpcopy的信息
麻烦各位大神看一下到底是哪块没有写对，不甚感激

**Comment by lazio579** [comment]
"tcpdump host 10.10.73.C -i any -s 0 -w 1.cap抓不到包，而tcpdump host 10.10.73.C -w 1.cap抓到包"
是否是-i any不支持呢？
尽量通过-i ethx来确定能够捕获数据包的接口吧。

./tcpcopy -x 20007-10.10.73.E:20017 -F 'host 10.10.73.C' -s 10.10.73.D -c 192.168.100.0
由于没有采用-i参数，可能也是同样的问题。

还有如下问题：
1）intercept不需要设置iptables命令，当然设置了也没有影响。
2）用tcpcopy 1.0吧，命令已经跟0.9.6已经不一样了。如果是1.0，命令应该这样： 
B机 ./tcpcopy -x 20007-10.10.73.E:20017 -F 'host 10.10.73.C' -s 10.10.73.D -c 192.168.100.x -i ethx

**Comment by wenjq** [comment]
多谢楼上大拿，我指定-i eth0 tcpdump可以获取到数据，tcpcopy仍然没有反应，日志部分如下
2015/05/05 00:27:30 +442 [info] connect to remote server(10.10.73.254:36524)
2015/05/05 00:27:30 +442 [info] connect to remote server(10.10.73.254:36524)
2015/05/05 00:27:30 +442 [notice] add dr tunnels for exchanging info:4266199562:36524
2015/05/05 00:27:30 +442 [notice] pcap open,device:eth0
2015/05/05 00:27:35 +451 [notice] session size:0
2015/05/05 00:27:35 +451 [notice] activate_dead_sessions
2015/05/05 00:27:40 +451 [notice] session size:0
2015/05/05 00:27:40 +451 [notice] activate_dead_sessions
2015/05/05 00:27:45 +451 [notice] session size:0
2015/05/05 00:27:45 +451 [notice] activate_dead_sessions
2015/05/05 00:27:50 +451 [notice] session size:0
2015/05/05 00:27:50 +451 [notice] activate_dead_sessions
2015/05/05 00:27:55 +451 [notice] session size:0
2015/05/05 00:27:55 +451 [notice] activate_dead_sessions
2015/05/05 00:28:00 +451 [notice] session size:0
2015/05/05 00:28:00 +451 [notice] activate_dead_sessions
2015/05/05 00:28:05 +451 [notice] session size:0
2015/05/05 00:28:05 +451 [notice] activate_dead_sessions
2015/05/05 00:28:10 +451 [notice] session size:0
2015/05/05 00:28:10 +451 [notice] activate_dead_sessions
2015/05/05 00:28:15 +451 [notice] session size:0
2015/05/05 00:28:15 +451 [notice] activate_dead_sessions
2015/05/05 00:28:20 +451 [notice] session size:0
2015/05/05 00:28:20 +451 [notice] activate_dead_sessions
2015/05/05 00:28:25 +451 [notice] session size:0
2015/05/05 00:28:25 +451 [notice] activate_dead_sessions
2015/05/05 00:28:30 +451 [notice] session size:0
2015/05/05 00:28:30 +451 [notice] activate_dead_sessions
2015/05/05 00:28:30 +451 [notice] user time used:0
2015/05/05 00:28:30 +451 [notice] sys  time used:0
2015/05/05 00:28:30 +451 [notice] max memory size:7964

**Comment by lazio579** [comment]
tcpcopy具体怎么运行的。

能用1.0版本吗？

**Comment by wenjq** [comment]
./tcpcopy -x 20007-10.10.73.E:20017 -F 'host 10.10.73.C' -s 10.10.73.D -c 192.168.100.x -i eth0
1.0我们这边用的redhead5.7装不上，少库

**Comment by wangbin579** [comment]
针对0.9.6版本：
./tcpcopy -x 20007-10.10.73.E:20017 -F 'tcp and dst port 20007' -s 10.10.73.D -c 192.168.100.* -i eth0

相对应的tcpdump命令：
tcpdump -i eth0  tcp and dst port 20007

如果tcpdump能够抓到，而tcpcopy抓不到包，那就是pcap的问题或者tcpcopy版本低的问题

尽量采用1.0版本，否则如果出现重复问题，解决也是没有意义的

**Comment by wenjq** [comment]
tcpdump能抓到包，tcpcopy抓不到包，我正在想办法换1.0并且调整下机器
我C\D\E三台机器实际是同一台实体机的虚拟机，我看官方说明应该也会对数据截取造成影响吧，这里有个疑惑，是不能用同一台机器的虚拟机，还是不同实体机间的虚拟机都不行？
另外，我在B机上的tcpcopy日志一直都是
2015/05/05 00:27:35 +451 [notice] activate_dead_sessions
 2015/05/05 00:27:40 +451 [notice] session size:0
 这样类似的，整个流程不成功应该还是tcpcopy没有抓到包造成的吧，这个日志抓到包又是怎样的呢，不太会看

**Comment by wangbin579** [comment]
不同环境有不同的故事，不能以偏概全的。
虚拟机环境各异，成功的是多数，不成功的是少数，都是有各自原因的。

你那里的问题是tcpcopy通过pcap接口，获取不了数据包，从而导致没有反应。

按道理，都是通过pcap接口来获取数据，不应该tcpdump能够获取，而 tcpcopy不能获取，除非虚拟机做了安全方面的限制。

实在不行，你可以先用tcpdump来抓下来（加上-s 0），然后利用tcpcopy的离线方式来离线回放

**Comment by wenjq** [comment]
我更换了1.0版本的tcpcopy仍然获取不到数据
PS：在安装tcpcopy1.0的时候，系统刚装好的时候就可以用tcpdump抓到包，也可以直接configure tcpcopy
但是指定参数configure --pcap-capture 的会提示需要安装pcap包，在安装完libpcap后才能正常安装
该情况在redhat和centos系统上都出现了
是否tcpcopy使用的pcap和系统默认使用的有出入会是可能原因？

**Comment by wangbin579** [comment]
提示libpcap包，是因为需要libpcap开发库，否则无法编译。

尽可能给出详细信息吧，一个细小的错误也有可能导致无法成功的。

信息越详细越好，内网ip地址，贴出来没有关系的，可以看看到底错误在哪儿

**Comment by wenjq** [comment]
感谢大牛的耐心解答
tcpcopy版本1.0.0
tcpcopy ./configure  --pcap-capture 
被镜像机   10.10.73.161
镜像机     10.10.73.169
intercept机  10.10.73.174
线上接收服务器  10.10.73.253  端口20007
测试接收服务器  10.10.73.254  端口20017
253和254为同一台实体机的虚拟机
174执行./intercept -F 'tcp' -l intercept.log
254执行 route add -net 192.168.100.0 netmask 255.255.255.0 gw 10.10.73.174
169执行 ./tcpcopy -x 20007-10.10.73.254:20017 -F 'tcp and dst port 20007' -s 10.10.73.174 -c 192.168.100.x -i eth0 -l tcpcopy.log

tcpdump的命令是tcpdump -i eth0 tcp and dst port 20007 -w pcap.cap，可以抓到161和253通信的报文
不知道是否是哪块用的不好，麻烦指正，谢谢

**Comment by wangbin579** [comment]
麻烦再给一个tcpcopy.log的信息吧

你也可以试验线上和测试服务器不再同一台实体机的时候，会不会也这样？

**Comment by wenjq** [comment]
已将253换成另一台机器224，tcpcopy.log日志信息如下
2015/05/07 18:33:55 +628 [notice] tcpcopy version:1.0.0
2015/05/07 18:33:55 +628 [notice] tcpcopy internal version:6
2015/05/07 18:33:55 +628 [notice] target:20007-10.10.73.254:20017
2015/05/07 18:33:55 +628 [notice] TC_PCAP mode
2015/05/07 18:33:55 +628 [notice] TC_COMBINED mode
2015/05/07 18:33:55 +628 [notice] session timeout:120
2015/05/07 18:33:55 +628 [notice] keepalive timeout:240
2015/05/07 18:33:55 +628 [notice] min sess pool size:576
2015/05/07 18:33:55 +628 [notice] sess pool size:1024
2015/05/07 18:33:55 +628 [notice] set global port for tcpcopy
2015/05/07 18:33:55 +628 [notice] raw_clt_tf_ip:192.168.100.x
2015/05/07 18:33:55 +628 [notice] parallel connections per target:2
2015/05/07 18:33:55 +628 [notice] device:eth0
2015/05/07 18:33:55 +628 [notice] user filter:tcp and dst port 20007
2015/05/07 18:33:55 +628 [notice] s parameter:10.10.73.174
2015/05/07 18:33:55 +628 [notice] set only ip for tcpcopy
2015/05/07 18:33:55 +628 [info] pool:11174800,block:11191200,len:44 occupy
2015/05/07 18:33:55 +628 [info] pool:11174800,block:11191200,len:44 occupy
2015/05/07 18:33:55 +628 [info] connect to remote server(10.10.73.174:36524)
2015/05/07 18:33:55 +628 [info] connect to remote server(10.10.73.174:36524)
2015/05/07 18:33:55 +628 [notice] pcap open,device:eth0
2015/05/07 18:33:55 +628 [notice] pcap_set_buffer_size:16777216
2015/05/07 18:34:55 +629 [notice] user time used:0
2015/05/07 18:34:55 +629 [notice] sys  time used:0
2015/05/07 18:34:55 +629 [notice] max memory size:37172
2015/05/07 18:34:55 +629 [notice] voluntary ctx switches:123
2015/05/07 18:34:55 +629 [notice] involuntary ctx switches:5
2015/05/07 18:35:23 +660 [warn] sig 2 received
2015/05/07 18:35:23 +660 [info] session table, size:65536, total:0
2015/05/07 18:35:23 +660 [notice] user time used:0
2015/05/07 18:35:23 +660 [notice] sys  time used:0
2015/05/07 18:35:23 +660 [notice] max memory size:37172
2015/05/07 18:35:23 +660 [notice] voluntary ctx switches:180
2015/05/07 18:35:23 +660 [notice] involuntary ctx switches:6
2015/05/07 18:35:23 +660 [notice] tc_select_destroy, close fd:4
2015/05/07 18:35:23 +660 [notice] tc_select_destroy, close fd:5
2015/05/07 18:35:23 +660 [notice] tc_select_destroy, close fd:7
2015/05/07 18:35:23 +660 [notice] tc_event_loop_finish over

**Comment by wenjq** [comment]
intercept.log的部分
2015/05/07 10:57:59 +323 [notice] intercept version:1.0.0
2015/05/07 10:57:59 +323 [notice] intercept internal version:6
2015/05/07 10:57:59 +323 [notice] TC_COMBINED mode
2015/05/07 10:57:59 +323 [notice] TC_ADVANCED mode
2015/05/07 10:57:59 +323 [notice] user filter:tcp
2015/05/07 10:57:59 +323 [notice] msg listen socket:4
2015/05/07 10:57:59 +323 [notice] pcap open,device:eth0
2015/05/07 10:57:59 +323 [notice] pcap_set_buffer_size:16777216
2015/05/07 10:57:59 +323 [notice] pcap open,device:nflog
2015/05/07 10:57:59 +323 [notice] pcap_set_buffer_size:16777216
2015/05/07 10:57:59 +323 [warn] lookupnet:SIOCGIFADDR: nflog: No such device
2015/05/07 10:57:59 +323 [warn] device could not work:nflog
2015/05/07 10:57:59 +323 [notice] pcap open,device:nfqueue
2015/05/07 10:57:59 +323 [notice] pcap_set_buffer_size:16777216
2015/05/07 10:57:59 +323 [warn] lookupnet:SIOCGIFADDR: nfqueue: No such device
2015/05/07 10:57:59 +323 [warn] device could not work:nfqueue
2015/05/07 10:57:59 +323 [notice] pcap open,device:lo
2015/05/07 10:57:59 +323 [notice] pcap_set_buffer_size:16777216
2015/05/07 10:57:59 +525 [notice] fd is null after session is created
2015/05/07 10:57:59 +525 [notice] from bak:10.10.51.80:51734-->10.10.73.174:22,len 40,seq=3042418186,ack=695985661
2015/05/07 10:58:29 +323 [notice] total resp packs:1, all:1, route:0, sock write cnt:0
2015/05/07 10:58:29 +323 [notice] cache hit:0,missed:0,lost:1
2015/05/07 10:58:29 +323 [notice] search:1,extra compared:0,all sessions:0
2015/05/07 10:58:39 +151 [notice] fd is null after session is created
2015/05/07 10:58:39 +151 [notice] from bak:10.10.73.169:47089-->10.10.73.174:36524,len 52,seq=2827517466,ack=1616142883
2015/05/07 10:58:39 +151 [notice] fd is null after session is created
2015/05/07 10:58:39 +151 [notice] from bak:10.10.73.169:47089-->10.10.73.174:36524,len 66,seq=2827517466,ack=1616142883
2015/05/07 10:58:39 +151 [notice] fd is null after session is created
2015/05/07 10:58:39 +151 [notice] from bak:10.10.73.174:36524-->10.10.73.169:47089,len 52,seq=1616142883,ack=2827517480
2015/05/07 10:58:39 +151 [notice] fd is null after session is created
2015/05/07 10:58:39 +151 [notice] from bak:10.10.73.169:47090-->10.10.73.174:36524,len 52,seq=1686930428,ack=2554872
2015/05/07 10:58:39 +151 [notice] fd is null after session is created
2015/05/07 10:58:39 +151 [notice] from bak:10.10.73.169:47090-->10.10.73.174:36524,len 66,seq=1686930428,ack=2554872
2015/05/07 10:58:39 +151 [notice] fd is null after session is created
2015/05/07 10:58:39 +151 [notice] from bak:10.10.73.174:36524-->10.10.73.169:47090,len 52,seq=2554872,ack=1686930442
2015/05/07 10:58:39 +151 [notice] it adds fd:9
2015/05/07 10:58:39 +152 [notice] it adds fd:10
2015/05/07 10:58:59 +323 [notice] total resp packs:11, all:11, route:0, sock write cnt:0
2015/05/07 10:58:59 +323 [notice] cache hit:0,missed:0,lost:11

这里说的11个包lost是什么意思？

**Comment by wenjq** [comment]
两边机器时间不一致这没关系吧

**Comment by wangbin579** [comment]
出现lost信息是因为，intercept的过滤条件太过于松散，没有精确过滤。
也即所有tcp的数据包，都被intercept截获了。
机器时间不一致没有关系。

你能贴一下：tcpdump -i eth0 tcp and dst port 20007 -w pcap.cap
抓包的内容吗？

**Comment by wenjq** [comment]
1	0.000000	10.10.73.161	10.10.73.226	TCP	74	45911 > 20007 [SYN] Seq=0 Win=5840 Len=0 MSS=1460 SACK_PERM=1 TSval=3697615496 TSecr=0 WS=128
2	0.000834	10.10.73.161	10.10.73.226	TCP	66	45911 > 20007 [ACK] Seq=1 Ack=1 Win=5888 Len=0 TSval=3697615496 TSecr=392563009
3	0.013690	10.10.73.161	10.10.73.226	TCP	74	45912 > 20007 [SYN] Seq=0 Win=5840 Len=0 MSS=1460 SACK_PERM=1 TSval=3697615509 TSecr=0 WS=128
4	0.013774	10.10.73.161	10.10.73.226	TCP	66	45912 > 20007 [ACK] Seq=1 Ack=1 Win=5888 Len=0 TSval=3697615509 TSecr=392563023
5	0.018665	10.10.73.161	10.10.73.226	TCP	74	45913 > 20007 [SYN] Seq=0 Win=5840 Len=0 MSS=1460 SACK_PERM=1 TSval=3697615514 TSecr=0 WS=128
6	0.018767	10.10.73.161	10.10.73.226	TCP	66	45913 > 20007 [ACK] Seq=1 Ack=1 Win=5888 Len=0 TSval=3697615514 TSecr=392563028
7	0.019479	10.10.73.161	10.10.73.226	TCP	74	45914 > 20007 [SYN] Seq=0 Win=5840 Len=0 MSS=1460 SACK_PERM=1 TSval=3697615515 TSecr=0 WS=128
8	0.019551	10.10.73.161	10.10.73.226	TCP	66	45914 > 20007 [ACK] Seq=1 Ack=1 Win=5888 Len=0 TSval=3697615515 TSecr=392563029
9	0.055152	10.10.73.161	10.10.73.226	TCP	105	45912 > 20007 [PSH, ACK] Seq=1 Ack=1 Win=5888 Len=39 TSval=3697615551 TSecr=392563023
10	0.055964	10.10.73.161	10.10.73.226	TCP	105	45914 > 20007 [PSH, ACK] Seq=1 Ack=1 Win=5888 Len=39 TSval=3697615551 TSecr=392563029
11	0.056699	10.10.73.161	10.10.73.226	TCP	105	45913 > 20007 [PSH, ACK] Seq=1 Ack=1 Win=5888 Len=39 TSval=3697615552 TSecr=392563028
12	0.057099	10.10.73.161	10.10.73.226	TCP	105	45911 > 20007 [PSH, ACK] Seq=1 Ack=1 Win=5888 Len=39 TSval=3697615553 TSecr=392563009
13	0.173537	10.10.73.161	10.10.73.226	TCP	66	45913 > 20007 [ACK] Seq=40 Ack=31 Win=5888 Len=0 TSval=3697615669 TSecr=392563183
14	0.173581	10.10.73.161	10.10.73.226	TCP	66	45911 > 20007 [ACK] Seq=40 Ack=31 Win=5888 Len=0 TSval=3697615669 TSecr=392563183
15	0.173590	10.10.73.161	10.10.73.226	TCP	66	45914 > 20007 [ACK] Seq=40 Ack=31 Win=5888 Len=0 TSval=3697615669 TSecr=392563183
16	0.173651	10.10.73.161	10.10.73.226	TCP	66	45912 > 20007 [ACK] Seq=40 Ack=31 Win=5888 Len=0 TSval=3697615669 TSecr=392563183
17	0.186856	10.10.73.161	10.10.73.226	TCP	275	45913 > 20007 [PSH, ACK] Seq=40 Ack=31 Win=5888 Len=209 TSval=3697615682 TSecr=392563183
18	0.287823	10.10.73.161	10.10.73.226	TCP	275	45914 > 20007 [PSH, ACK] Seq=40 Ack=31 Win=5888 Len=209 TSval=3697615783 TSecr=392563183
19	0.300625	10.10.73.161	10.10.73.226	TCP	66	45913 > 20007 [ACK] Seq=249 Ack=52 Win=5888 Len=0 TSval=3697615796 TSecr=392563270
20	0.300738	10.10.73.161	10.10.73.226	TCP	66	45913 > 20007 [ACK] Seq=249 Ack=197 Win=6912 Len=0 TSval=3697615796 TSecr=392563310
这是部分

**Comment by wangbin579** [comment]
从上面log来分析，确实没有一个数据包被捕获到。

能够尝试一下用最新版本吗？
git clone git://github.com/session-replay-tools/tcpcopy.git

这个会输出更多log信息，特别是pcap的信息。

还有试验一下tcpcopy加上-F ‘tcp’这个条件，看看能不能捕获一个tcp数据包？

**Comment by wangbin579** [comment]
重现了你的问题，应该离问题解决不远了

**Comment by wangbin579** [comment]
不好意思，虽然现象类似，但不是同一个问题。

你尝试一下，不采用镜像方式，直接在线上服务器运行tcpcopy，看看能不能抓到包？

**Comment by wenjq** [comment]
线上服务器上之前就试过了，可以抓的

**Comment by wenjq** [comment]
最新版就是1.0.0吧？我用的就是这个地址下载的1.0.0版本啊

**Comment by wenjq** [comment]
-F  'tcp'获取不到数据

**Comment by wangbin579** [comment]
如果是最新开发版本，会输出：
pcap version的信息的

**Comment by wenjq** [comment]
我刚又下了一次，对比了下大小是一样的

**Comment by wangbin579** [comment]
你看看src/tcpcopy/main.c源代码：
有没有pcap version
 381 #if (TC_PCAP)
 382     tc_log_info(LOG_NOTICE, 0, "pcap version:%s", pcap_lib_version());
 383 #if (HAVE_SET_IMMEDIATE_MODE)
 384     tc_log_info(LOG_NOTICE, 0, "HAVE_SET_IMMEDIATE_MODE is true");
 385 #endif
 386     tc_log_info(LOG_NOTICE, 0, "TC_PCAP mode");
 387 #endif

**Comment by wangbin579** [comment]
如果是最新版本，不输出pcap version，就很诡异了。

之前用户案例里面，还没有出现过，tcpdump能够捕获，而tcpcopy pcap接口无法捕获数据包的情况存在。

**Comment by wenjq** [comment]
381 #if (TC_PCAP)
    tc_log_info(LOG_NOTICE, 0, "TC_PCAP mode");
#endif
#if (TC_SINGLE)
    tc_log_info(LOG_NOTICE, 0, "TC_SINGLE mode");
#endif
还真没有，能否发一个最新版本到我邮箱呢512270575@qq.com

**Comment by wangbin579** [comment]
你确信是通过git clone来获取的吗？

**Comment by wenjq** [comment]
不是，是在https://github.com/session-replay-tools/tcpcopy/releases/tag/1.0.0这里下的

**Comment by wangbin579** [comment]
请使用开发版本尝试一下吧。

开发版本和release版本之间有一个差别：
修复了pcap本身的缺陷

看看有没有这方面可能，如果最新版本还是那样，请贴出log信息

**Comment by wenjq** [comment]
能传一个开发版给我么，我这边git装的比较慢，我先试试，谢谢

**Comment by wenjq** [comment]
2015/05/08 00:13:45 +149 [notice] tcpcopy version:1.0.0
2015/05/08 00:13:45 +149 [notice] tcpcopy internal version:6
2015/05/08 00:13:45 +149 [notice] target:20007-10.10.73.254:20017
2015/05/08 00:13:45 +149 [notice] pcap version:libpcap version 1.4.0
2015/05/08 00:13:45 +149 [notice] HAVE_SET_IMMEDIATE_MODE is true
2015/05/08 00:13:45 +149 [notice] TC_PCAP mode
2015/05/08 00:13:45 +149 [notice] TC_COMBINED mode
2015/05/08 00:13:45 +149 [notice] epoll mode
2015/05/08 00:13:45 +149 [notice] session timeout:120
2015/05/08 00:13:45 +149 [notice] keepalive timeout:240
2015/05/08 00:13:45 +149 [notice] min sess pool size:576
2015/05/08 00:13:45 +149 [notice] sess pool size:1024
2015/05/08 00:13:45 +149 [notice] set global port for tcpcopy
2015/05/08 00:13:45 +149 [notice] raw_clt_tf_ip:192.168.100.x
2015/05/08 00:13:45 +149 [notice] parallel connections per target:2
2015/05/08 00:13:45 +149 [notice] device:eth0
2015/05/08 00:13:45 +149 [notice] user filter:tcp and dst port 20007
2015/05/08 00:13:45 +149 [notice] s parameter:10.10.73.174
2015/05/08 00:13:45 +149 [notice] set only ip for tcpcopy
2015/05/08 00:13:45 +149 [info] pool:17814432,block:17830832,len:44 occupy
2015/05/08 00:13:45 +149 [info] pool:17814432,block:17830832,len:44 occupy
2015/05/08 00:13:45 +149 [info] connect to remote server(10.10.73.174:36524)
2015/05/08 00:13:45 +149 [info] connect to remote server(10.10.73.174:36524)
2015/05/08 00:13:45 +149 [notice] pcap open,device:eth0
2015/05/08 00:13:45 +149 [notice] pcap_set_buffer_size:16777216
2015/05/08 00:14:45 +150 [notice] user time used:0
2015/05/08 00:14:45 +150 [notice] sys  time used:0
2015/05/08 00:14:45 +150 [notice] max memory size:37184
2015/05/08 00:14:45 +150 [notice] voluntary ctx switches:123
2015/05/08 00:14:45 +150 [notice] involuntary ctx switches:3
2015/05/08 00:15:30 +667 [warn] sig 2 received
2015/05/08 00:15:30 +667 [info] session table, size:65536, total:0
2015/05/08 00:15:30 +667 [notice] user time used:0
2015/05/08 00:15:30 +667 [notice] sys  time used:0
2015/05/08 00:15:30 +667 [notice] max memory size:37184
2015/05/08 00:15:30 +667 [notice] voluntary ctx switches:214
2015/05/08 00:15:30 +667 [notice] involuntary ctx switches:3
2015/05/08 00:15:30 +667 [notice] tc_epoll_destroy, close fd:5
2015/05/08 00:15:30 +667 [notice] tc_epoll_destroy, close fd:6
2015/05/08 00:15:30 +667 [notice] tc_epoll_destroy, close fd:8
2015/05/08 00:15:30 +667 [notice] tc_event_loop_finish over

**Comment by wangbin579** [comment]
辛苦。

我这边的相应log：

  4 2015/05/07 12:08:54 +286 [notice] pcap version:libpcap version 1.5.3
  5 2015/05/07 12:08:54 +286 [notice] HAVE_SET_IMMEDIATE_MODE is true
  6 2015/05/07 12:08:54 +286 [notice] TC_PCAP mode

和
2015/05/07 13:54:57 +729 [notice] pcap version:libpcap version 1.4.0
2015/05/07 13:54:57 +729 [notice] TC_PCAP mode

均是可以的。

环境不一样的是：
我这边：
pcap 1.4.0
你那边：
pcap 1.4.0且HAVE_SET_IMMEDIATE_MODE为true

你能试验libpcap 1.5.3或者比1.4.0更低版本的吗？

只能推测出上述内容了。

**Comment by wenjq** [comment]
冒昧的问一下，您那边也是交换机镜像获取的数据么，我如果不采用镜像，在服务器上直接tcpcopy都是可行的

**Comment by wangbin579** [comment]
据用户反馈，交换机镜像，之前都是成功的（不少于3例），google也能搜索到有这样的案例。

还可以通过https://github.com/session-replay-tools/mirror来进行软件镜像，也是成功的。



2015-05-07






发件人：wenjq <notifications@github.com>
发送时间：2015-05-07 16:31
主题：Re: [tcpcopy] tcpcopy在交换机镜像下的数据获取问题 (#206)
收件人："session-replay-tools/tcpcopy"<tcpcopy@noreply.github.com>
抄送："Bin Wang"<wangbin579@gmail.com>

冒昧的问一下，您那边也是交换机镜像获取的数据么，我如果不采用镜像，在服务器上直接tcpcopy都是可行的

**Comment by wangbin579** [comment]
你那边，应该是pcap抓包方面出了问题导致的。

换个libpcap库试验一下吧，libpcap库（HAVE_SET_IMMEDIATE_MODE问题）曾经导致大量软件不可用，都可以查到的

**Comment by wenjq** [comment]
2015/05/08 02:52:11 +156 [notice] tcpcopy version:1.0.0
2015/05/08 02:52:11 +156 [notice] tcpcopy internal version:6
2015/05/08 02:52:11 +156 [notice] target:20007-10.10.73.254:20017
2015/05/08 02:52:11 +156 [notice] pcap version:libpcap version 1.5.3
2015/05/08 02:52:11 +156 [notice] HAVE_SET_IMMEDIATE_MODE is true
2015/05/08 02:52:11 +156 [notice] TC_PCAP mode
2015/05/08 02:52:11 +156 [notice] TC_COMBINED mode
2015/05/08 02:52:11 +156 [notice] epoll mode
2015/05/08 02:52:11 +156 [notice] session timeout:120
2015/05/08 02:52:11 +156 [notice] keepalive timeout:240
2015/05/08 02:52:11 +156 [notice] min sess pool size:576
2015/05/08 02:52:11 +156 [notice] sess pool size:1024
2015/05/08 02:52:11 +156 [notice] set global port for tcpcopy
2015/05/08 02:52:11 +156 [notice] raw_clt_tf_ip:192.168.100.x
2015/05/08 02:52:11 +156 [notice] parallel connections per target:2
2015/05/08 02:52:11 +156 [notice] device:eth0
2015/05/08 02:52:11 +156 [notice] user filter:tcp and dst port 20007
2015/05/08 02:52:11 +156 [notice] s parameter:10.10.73.174
2015/05/08 02:52:11 +156 [notice] set only ip for tcpcopy
2015/05/08 02:52:11 +156 [info] pool:13026208,block:13042608,len:44 occupy
2015/05/08 02:52:11 +156 [info] pool:13026208,block:13042608,len:44 occupy
2015/05/08 02:52:11 +156 [info] connect to remote server(10.10.73.174:36524)
2015/05/08 02:52:11 +156 [info] connect to remote server(10.10.73.174:36524)
2015/05/08 02:52:11 +156 [notice] pcap open,device:eth0
2015/05/08 02:52:11 +156 [notice] pcap_set_buffer_size:16777216
2015/05/08 02:53:11 +157 [notice] user time used:0
2015/05/08 02:53:11 +157 [notice] sys  time used:0
2015/05/08 02:53:11 +157 [notice] max memory size:37192
2015/05/08 02:53:11 +157 [notice] voluntary ctx switches:123
2015/05/08 02:53:11 +157 [notice] involuntary ctx switches:4
2015/05/08 02:53:41 +659 [warn] sig 2 received
2015/05/08 02:53:41 +659 [info] session table, size:65536, total:0
2015/05/08 02:53:41 +659 [notice] user time used:0
2015/05/08 02:53:41 +659 [notice] sys  time used:0
2015/05/08 02:53:41 +659 [notice] max memory size:37192
2015/05/08 02:53:41 +659 [notice] voluntary ctx switches:184
2015/05/08 02:53:41 +659 [notice] involuntary ctx switches:4
2015/05/08 02:53:41 +659 [notice] tc_epoll_destroy, close fd:5
2015/05/08 02:53:41 +659 [notice] tc_epoll_destroy, close fd:6
2015/05/08 02:53:41 +659 [notice] tc_epoll_destroy, close fd:8
2015/05/08 02:53:41 +659 [notice] tc_event_loop_finish over

**Comment by wenjq** [comment]
离线回放也试过了，没有问题。抓不到包的问题请问有什么高招么

**Comment by wangbin579** [comment]
辛苦。

只能推理了，既然pcap还是这样的问题，而其它用户抓交换机镜像过来的数据包没有有此问题，最大可能原因就是安全方面的原因了。

还可以继续的招：
1）可以尝试一下最简单的pcap抓包例子，看看是否也不能抓到镜像过来的数据包
2）利用物理机来尝试，排除虚拟机做的安全限制（可能tcpdump允许，而其它程序不允许抓包）

正常情况下，是可以的，但可能环境太过于特殊，导致不容易诊断

**Comment by wenjq** [comment]
我这边镜像的两台161&169都是物理机，我再试试别的吧

**Comment by wangbin579** [comment]
奥。

tcpdump抓的镜像数据包文件，能否发过来一份(wangbin579@gmail.com)，这样可以利用tcpreplay来回放这些数据包，然后看看tcpcopy能否捕获数据包

**Comment by lazio579** [comment]
尝试一下设置相应网卡成混杂模式，看看tcpcopy能不能捕获到镜像过来的数据包?

tcpdump能够抓到，而tcpcopy不能抓到，是因为tcpdump在程序中设置了混杂模式而tcpcopy没有。
