### ISSUE TITLE
请教：用tcpcopy离线回放已测试成功，加上ngxin做负载均衡之后，就不行了。

### ISSUE THREAD

**Issue by codecola** [session-replay-tools/tcpcopy#387]
环境信息：
10.213.0.47是nginx所在主机，10.213.3.157是请求ip，10.213.0.45是intercept主机，10.213.0.47和10.213.0.48是测试主机
在10.213.0.47上添加了如下路由：
route add -net 10.213.3.0 netmask 255.255.255.0 gw 10.213.0.45

tcpcopy回放指令：
/usr/local/tcpcopy/sbin/tcpcopy -x 20050-10.213.0.47:8088 -s 10.213.0.45:33333 -i 1.pcap -c 10.213.3.157

在10.213.0.47上抓了8088端口的包，如下：
1 0.000000 10.213.0.47 10.213.3.157 TCP 58 8088 → 1697 [SYN, ACK] Seq=0 Ack=1 Win=29200 Len=0 MSS=1460
2 1.000599 10.213.0.47 10.213.3.157 TCP 58 [TCP Retransmission] 8088 → 1697 [SYN, ACK] Seq=0 Ack=1 Win=29200 Len=0 MSS=1460
3 3.200658 10.213.0.47 10.213.3.157 TCP 58 [TCP Retransmission] 8088 → 1697 [SYN, ACK] Seq=0 Ack=1 Win=29200 Len=0 MSS=1460
4 7.200580 10.213.0.47 10.213.3.157 TCP 58 [TCP Retransmission] 8088 → 1697 [SYN, ACK] Seq=0 Ack=1 Win=29200 Len=0 MSS=1460
5 10.030305 10.213.0.47 10.213.3.157 TCP 54 8088 → 1697 [RST, ACK] Seq=161742455 Ack=259 Win=0 Len=0
7 39.324581 10.213.0.47 10.213.3.157 TCP 58 [TCP Retransmission] 8088 → 1616 [SYN, ACK] Seq=0 Ack=1 Win=29200 Len=0 MSS=1460

10.213.0.47上抓包没有任何信息；

如果是使用tcpcopy直接将请求回放到10.213.0.47或10.213.0.48的8087端口，则没有问题。
/usr/local/tcpcopy/sbin/tcpcopy -x 20050-10.213.0.47:8087 -s 10.213.0.45:33333 -i 1.pcap -c 10.213.3.157

请帮忙分析一下原因，谢谢！

**Comment by codecola** [comment]
补充一句：10.213.0.47或10.213.0.48的8087端口是测试端口

**Comment by codecola** [comment]
补充intercept端口33333的抓包数据：
1	0.000000	10.213.0.47	10.213.0.45	TCP	74	36714 → 33333 [SYN] Seq=0 Win=29200 Len=0 MSS=1460 SACK_PERM=1 TSval=2099572248 TSecr=0 WS=128
2	0.000198	10.213.0.45	10.213.0.47	TCP	74	33333 → 36714 [SYN, ACK] Seq=0 Ack=1 Win=28960 Len=0 MSS=1460 SACK_PERM=1 TSval=2099649179 TSecr=2099572248 WS=128
3	0.000591	10.213.0.47	10.213.0.45	TCP	66	36714 → 33333 [ACK] Seq=1 Ack=1 Win=29312 Len=0 TSval=2099572248 TSecr=2099649179
4	0.000655	10.213.0.47	10.213.0.45	TCP	80	36714 → 33333 [PSH, ACK] Seq=1 Ack=1 Win=29312 Len=14 TSval=2099572249 TSecr=2099649179
6	0.000675	10.213.0.45	10.213.0.47	TCP	66	33333 → 36714 [ACK] Seq=1 Ack=15 Win=29056 Len=0 TSval=2099649179 TSecr=2099572249
11	0.001180	10.213.0.47	10.213.0.45	TCP	80	36714 → 33333 [PSH, ACK] Seq=15 Ack=1 Win=29312 Len=14 TSval=2099572249 TSecr=2099649179
12	0.001203	10.213.0.45	10.213.0.47	TCP	66	33333 → 36714 [ACK] Seq=1 Ack=29 Win=29056 Len=0 TSval=2099649180 TSecr=2099572249
15	12.577717	10.213.0.47	10.213.0.45	TCP	66	36714 → 33333 [FIN, ACK] Seq=29 Ack=1 Win=29312 Len=0 TSval=2099584825 TSecr=2099649180
18	12.578090	10.213.0.45	10.213.0.47	TCP	66	33333 → 36714 [FIN, ACK] Seq=1 Ack=30 Win=29056 Len=0 TSval=2099661757 TSecr=2099584825
19	12.578435	10.213.0.47	10.213.0.45	TCP	66	36714 → 33333 [ACK] Seq=30 Ack=2 Win=29312 Len=0 TSval=2099584826 TSecr=2099661757
