### ISSUE TITLE
tcpcopy1.0离线回放失败

### ISSUE THREAD

**Issue by tonyying** [session-replay-tools/tcpcopy#285]
tcpcopy version:1.0.0
intercept version:1.0.0
tcpcopy安装时也加上了 --offline
想在回放机195上回放录制的online.pcap，将请求发到测试机196上，但是回放后查看196相关服务的日志并没有收到请求。执行脚本如下，请帮忙看看是哪里出了问题，谢谢

1）测试机上执行：
/usr/local/intercept/sbin/intercept -i eth1 -l /var/log/intercept.log -F 'tcp and src port 54322' -d

2）回放机上执行：
/usr/local/tcpcopy/sbin/tcpcopy -l /var/log/tcpcopy.log -x 54322-10.1.2.196:54322 -s 10.1.2.196 -i ./online.pcap

日志打印：
-----------/var/log/tcpcopy.log-----------
2017/05/22 19:34:47 +126 [notice] tcpcopy version:1.0.0
2017/05/22 19:34:47 +126 [notice] tcpcopy internal version:6
2017/05/22 19:34:47 +126 [notice] target:54322-10.1.2.196:54322
2017/05/22 19:34:47 +126 [notice] TC_OFFLINE mode
2017/05/22 19:34:47 +126 [notice] TC_COMBINED mode
2017/05/22 19:34:47 +126 [notice] epoll mode
2017/05/22 19:34:47 +126 [notice] session timeout:120
2017/05/22 19:34:47 +126 [notice] keepalive timeout:240
2017/05/22 19:34:47 +126 [notice] min sess pool size:608
2017/05/22 19:34:47 +126 [notice] sess pool size:1024
2017/05/22 19:34:47 +126 [notice] set global port for tcpcopy
2017/05/22 19:34:47 +126 [notice] parallel connections per target:2
2017/05/22 19:34:47 +126 [notice] accelerated 1 times,interval:0 ms
2017/05/22 19:34:47 +126 [notice] s parameter:10.1.2.196
2017/05/22 19:34:47 +126 [notice] set only ip for tcpcopy
2017/05/22 19:34:47 +126 [info] connect to remote server(10.1.2.196:36524)
2017/05/22 19:34:47 +126 [info] connect to remote server(10.1.2.196:36524)
2017/05/22 19:34:47 +126 [notice] open pcap success:./online.pcap
2017/05/22 19:34:47 +126 [notice] send the first packets here
2017/05/22 19:34:49 +854 [notice] stop, null from pcap_next
2017/05/22 19:35:04 +327 [warn] sig 2 received
2017/05/22 19:35:04 +327 [notice] active:0,rel:2,obs del:0,tw:0
2017/05/22 19:35:04 +327 [notice] conns:2,resp:4,c-resp:0
2017/05/22 19:35:04 +327 [notice] resp fin:0,resp rst:2
2017/05/22 19:35:04 +327 [notice] send:6,send content:2
2017/05/22 19:35:04 +327 [notice] send syn:2, fin:0,reset:0
2017/05/22 19:35:04 +327 [notice] reconnect:0,for no syn:0
2017/05/22 19:35:04 +327 [notice] retransmit:0
2017/05/22 19:35:04 +327 [notice] recv packs after retransmission:0
2017/05/22 19:35:04 +327 [notice] syn cnt:2,all clt:8,clt cont:2
2017/05/22 19:35:04 +327 [notice] total cont retransmit:0, frag:0
2017/05/22 19:35:04 +327 [notice] total captured packets:20
2017/05/22 19:35:04 +327 [info] session table, size:65536, total:0
2017/05/22 19:35:04 +327 [notice] tc_epoll_destroy, close fd:5
2017/05/22 19:35:04 +327 [notice] tc_epoll_destroy, close fd:6
2017/05/22 19:35:04 +327 [notice] tc_event_loop_finish over
2017/05/22 19:35:04 +327 [notice] user time used:0
2017/05/22 19:35:04 +327 [notice] sys  time used:0
2017/05/22 19:35:04 +327 [notice] max memory size:4404
2017/05/22 19:35:04 +327 [notice] Total allocated space (bytes): 400
2017/05/22 19:35:04 +327 [notice] Total free space (bytes): 134768
2017/05/22 19:35:04 +327 [notice] Top-most, releasable space (bytes): 134320
2017/05/22 19:35:24 +070 [notice] tcpcopy version:1.0.0
2017/05/22 19:35:24 +070 [notice] tcpcopy internal version:6
2017/05/22 19:35:24 +070 [notice] target:54322-10.1.2.196:54322
2017/05/22 19:35:24 +070 [notice] TC_OFFLINE mode
2017/05/22 19:35:24 +070 [notice] TC_COMBINED mode
2017/05/22 19:35:24 +070 [notice] epoll mode
2017/05/22 19:35:24 +070 [notice] session timeout:120
2017/05/22 19:35:24 +070 [notice] keepalive timeout:240
2017/05/22 19:35:24 +070 [notice] min sess pool size:608
2017/05/22 19:35:24 +070 [notice] sess pool size:1024
2017/05/22 19:35:24 +070 [notice] set global port for tcpcopy
2017/05/22 19:35:24 +070 [notice] parallel connections per target:2
2017/05/22 19:35:24 +070 [notice] accelerated 1 times,interval:0 ms
2017/05/22 19:35:24 +070 [notice] s parameter:10.1.2.196
2017/05/22 19:35:24 +070 [notice] set only ip for tcpcopy
2017/05/22 19:35:24 +070 [info] connect to remote server(10.1.2.196:36524)
2017/05/22 19:35:24 +070 [info] connect to remote server(10.1.2.196:36524)
2017/05/22 19:35:24 +070 [notice] open pcap success:./online.pcap
2017/05/22 19:35:24 +070 [notice] send the first packets here
2017/05/22 19:35:26 +797 [notice] stop, null from pcap_next
2017/05/22 19:35:54 +070 [notice] active:0,rel:2,obs del:0,tw:0
2017/05/22 19:35:54 +070 [notice] conns:2,resp:4,c-resp:0
2017/05/22 19:35:54 +070 [notice] resp fin:0,resp rst:2
2017/05/22 19:35:54 +070 [notice] send:4,send content:0
2017/05/22 19:35:54 +070 [notice] send syn:2, fin:0,reset:0
2017/05/22 19:35:54 +070 [notice] reconnect:0,for no syn:0
2017/05/22 19:35:54 +070 [notice] retransmit:0
2017/05/22 19:35:54 +070 [notice] recv packs after retransmission:0
2017/05/22 19:35:54 +070 [notice] syn cnt:2,all clt:12,clt cont:2
2017/05/22 19:35:54 +070 [notice] total cont retransmit:0, frag:0
2017/05/22 19:35:54 +070 [notice] total captured packets:20
2017/05/22 19:36:21 +409 [warn] sig 2 received
2017/05/22 19:36:21 +409 [notice] active:0,rel:2,obs del:0,tw:0
2017/05/22 19:36:21 +409 [notice] conns:2,resp:4,c-resp:0
2017/05/22 19:36:21 +409 [notice] resp fin:0,resp rst:2
2017/05/22 19:36:21 +409 [notice] send:4,send content:0
2017/05/22 19:36:21 +409 [notice] send syn:2, fin:0,reset:0
2017/05/22 19:36:21 +409 [notice] reconnect:0,for no syn:0
2017/05/22 19:36:21 +409 [notice] retransmit:0
2017/05/22 19:36:21 +409 [notice] recv packs after retransmission:0
2017/05/22 19:36:21 +409 [notice] syn cnt:2,all clt:12,clt cont:2
2017/05/22 19:36:21 +409 [notice] total cont retransmit:0, frag:0
2017/05/22 19:36:21 +409 [notice] total captured packets:20
2017/05/22 19:36:21 +409 [info] session table, size:65536, total:0
2017/05/22 19:36:21 +409 [notice] tc_epoll_destroy, close fd:5
2017/05/22 19:36:21 +409 [notice] tc_epoll_destroy, close fd:6
2017/05/22 19:36:21 +409 [notice] tc_event_loop_finish over
2017/05/22 19:36:21 +409 [notice] user time used:0
2017/05/22 19:36:21 +409 [notice] sys  time used:0
2017/05/22 19:36:21 +409 [notice] max memory size:4844
2017/05/22 19:36:21 +409 [notice] Total allocated space (bytes): 400
2017/05/22 19:36:21 +409 [notice] Total free space (bytes): 134768
2017/05/22 19:36:21 +409 [notice] Top-most, releasable space (bytes): 134320
2017/05/22 19:39:44 +715 [notice] tcpcopy version:1.0.0
2017/05/22 19:39:44 +715 [notice] tcpcopy internal version:6
2017/05/22 19:39:44 +715 [notice] target:54322-10.1.2.196:54322
2017/05/22 19:39:44 +715 [notice] TC_OFFLINE mode
2017/05/22 19:39:44 +715 [notice] TC_COMBINED mode
2017/05/22 19:39:44 +715 [notice] epoll mode
2017/05/22 19:39:44 +715 [notice] session timeout:120
2017/05/22 19:39:44 +715 [notice] keepalive timeout:240
2017/05/22 19:39:44 +715 [notice] min sess pool size:608
2017/05/22 19:39:44 +715 [notice] sess pool size:1024
2017/05/22 19:39:44 +715 [notice] set global port for tcpcopy
2017/05/22 19:39:44 +715 [notice] parallel connections per target:2
2017/05/22 19:39:44 +715 [notice] accelerated 1 times,interval:0 ms
2017/05/22 19:39:44 +715 [notice] s parameter:10.1.2.196
2017/05/22 19:39:44 +715 [notice] set only ip for tcpcopy
2017/05/22 19:39:44 +715 [info] connect to remote server(10.1.2.196:36524)
2017/05/22 19:39:44 +715 [info] connect to remote server(10.1.2.196:36524)
2017/05/22 19:39:44 +715 [notice] open pcap success:./online.pcap
2017/05/22 19:39:44 +715 [notice] send the first packets here
2017/05/22 19:39:44 +725 [notice] stop, null from pcap_next
2017/05/22 19:40:14 +715 [notice] active:0,rel:1,obs del:0,tw:0
2017/05/22 19:40:14 +715 [notice] conns:1,resp:2,c-resp:0
2017/05/22 19:40:14 +715 [notice] resp fin:0,resp rst:1
2017/05/22 19:40:14 +715 [notice] send:3,send content:1
2017/05/22 19:40:14 +715 [notice] send syn:1, fin:0,reset:0
2017/05/22 19:40:14 +715 [notice] reconnect:0,for no syn:0
2017/05/22 19:40:14 +715 [notice] retransmit:0
2017/05/22 19:40:14 +715 [notice] recv packs after retransmission:0
2017/05/22 19:40:14 +715 [notice] syn cnt:1,all clt:4,clt cont:1
2017/05/22 19:40:14 +715 [notice] total cont retransmit:0, frag:0
2017/05/22 19:40:14 +715 [notice] total captured packets:10

-----------/var/log/intercept.log-----------
2017/05/22 19:37:45 +823 [notice] total resp packs:17, all:17, route:4, sock write cnt:9
2017/05/22 19:37:45 +823 [notice] cache hit:8,missed:0,lost:9
2017/05/22 19:37:45 +823 [notice] search:17,extra compared:0,all sessions:4
2017/05/22 19:38:09 +786 [notice] intercept version:1.0.0
2017/05/22 19:38:09 +786 [notice] intercept internal version:6
2017/05/22 19:38:09 +786 [notice] TC_COMBINED mode
2017/05/22 19:38:09 +786 [notice] pcap version:libpcap version 1.4.0
2017/05/22 19:38:09 +786 [notice] HAVE_SET_IMMEDIATE_MODE is true
2017/05/22 19:38:09 +786 [notice] TC_ADVANCED mode
2017/05/22 19:38:09 +786 [notice] epoll mode
2017/05/22 19:38:09 +786 [notice] device:eth1
2017/05/22 19:38:09 +786 [notice] user filter:tcp and src port 54322
2017/05/22 19:38:09 +786 [notice] msg listen socket:5
2017/05/22 19:38:09 +786 [notice] pcap open,device:eth1
2017/05/22 19:38:09 +786 [notice] pcap_set_buffer_size:16777216
2017/05/22 19:38:39 +787 [notice] total resp packs:0, all:0, route:0, sock write cnt:0
2017/05/22 19:38:39 +787 [notice] cache hit:0,missed:0,lost:0
2017/05/22 19:38:39 +787 [notice] search:0,extra compared:0,all sessions:0
2017/05/22 19:39:09 +787 [notice] total resp packs:0, all:0, route:0, sock write cnt:0
2017/05/22 19:39:09 +787 [notice] cache hit:0,missed:0,lost:0
2017/05/22 19:39:09 +787 [notice] search:0,extra compared:0,all sessions:0
2017/05/22 19:39:39 +788 [notice] total resp packs:0, all:0, route:0, sock write cnt:0
2017/05/22 19:39:39 +788 [notice] cache hit:0,missed:0,lost:0
2017/05/22 19:39:39 +788 [notice] search:0,extra compared:0,all sessions:0
2017/05/22 19:39:44 +719 [notice] it adds fd:7
2017/05/22 19:39:44 +719 [notice] it adds fd:8
2017/05/22 19:39:44 +719 [info] malloc memory for fd:7
2017/05/22 19:40:09 +788 [notice] total resp packs:3, all:3, route:1, sock write cnt:3
2017/05/22 19:40:09 +788 [notice] cache hit:3,missed:0,lost:0
2017/05/22 19:40:09 +788 [notice] search:3,extra compared:0,all sessions:1

正常请求服务器抓包结果：
19:37:08.153356 IP 10.1.2.195.53450 > 10.1.2.196.54322: Flags [S], seq 3794108764, win 14480, options [mss 1460,sackOK,TS val 3761866308 ecr 3761852652,nop,wscale 9], length 0
19:37:08.153522 IP 10.1.2.196.54322 > 10.1.2.195.53450: Flags [S.], seq 609916108, ack 3794108765, win 14480, options [mss 1460,sackOK,TS val 3761865123 ecr 3761866308,nop,wscale 9], length 0
19:37:08.153542 IP 10.1.2.195.53450 > 10.1.2.196.54322: Flags [.], ack 1, win 29, options [nop,nop,TS val 3761866308 ecr 3761865123], length 0
19:37:08.153573 IP 10.1.2.195.53450 > 10.1.2.196.54322: Flags [P.], seq 1:168, ack 1, win 29, options [nop,nop,TS val 3761866308 ecr 3761865123], length 167
19:37:08.153683 IP 10.1.2.196.54322 > 10.1.2.195.53450: Flags [.], ack 168, win 31, options [nop,nop,TS val 3761865123 ecr 3761866308], length 0
19:37:08.154715 IP 10.1.2.196.54322 > 10.1.2.195.53450: Flags [P.], seq 1:121, ack 168, win 31, options [nop,nop,TS val 3761865124 ecr 3761866308], length 120
19:37:08.154725 IP 10.1.2.195.53450 > 10.1.2.196.54322: Flags [.], ack 121, win 29, options [nop,nop,TS val 3761866309 ecr 3761865124], length 0
19:37:08.154858 IP 10.1.2.195.53450 > 10.1.2.196.54322: Flags [F.], seq 168, ack 121, win 29, options [nop,nop,TS val 3761866309 ecr 3761865124], length 0
19:37:08.155009 IP 10.1.2.196.54322 > 10.1.2.195.53450: Flags [F.], seq 121, ack 169, win 31, options [nop,nop,TS val 3761865124 ecr 3761866309], length 0
19:37:08.155023 IP 10.1.2.195.53450 > 10.1.2.196.54322: Flags [.], ack 122, win 29, options [nop,nop,TS val 3761866309 ecr 3761865124], length 0

回放时的抓包结果（均为length 0）：
19:39:44.720292 IP 10.1.2.195.53401 > 10.1.2.196.54322: Flags [S], seq 3698574804, win 14480, options [mss 1460,sackOK,TS val 3761853835 ecr 3761818392,nop,wscale 9], length 0
19:39:44.720421 IP 10.1.2.196.54322 > 10.1.2.195.53401: Flags [S.], seq 953723195, ack 3698574805, win 14480, options [mss 1460,sackOK,TS val 3762021690 ecr 3761853835,nop,wscale 9], length 0
19:39:44.720436 IP 10.1.2.195.53401 > 10.1.2.196.54322: Flags [R], seq 3698574805, win 0, length 0
19:39:44.720492 IP 10.1.2.195.53401 > 10.1.2.196.54322: Flags [.], ack 1, win 29, options [nop,nop,TS val 3761853836 ecr 3762021690], length 0
19:39:44.720606 IP 10.1.2.196.54322 > 10.1.2.195.53401: Flags [R], seq 953723196, win 0, length 0
19:39:44.725582 IP 10.1.2.195.53401 > 10.1.2.196.54322: Flags [P.], seq 1:168, ack 1, win 29, options [nop,nop,TS val 3761853836 ecr 3762021690], length 167
19:39:44.725733 IP 10.1.2.196.54322 > 10.1.2.195.53401: Flags [R], seq 953723196, win 0, length 0

**Comment by wangbin579** [comment]
问题：
没有安装要求来做，针对响应包的路由没有设置

解释：
第二次握手数据包，就回到了195机器，195机器其实本没有和196机器进行三次握手，于是立即回送了rst数据包，session会话被终止，当然上层请求就无法过去了。

解决方案：
通过-c改变访问196机器的客户端ip地址，如果不想设置路由，得设置成不存在的ip地址或者那个ip地址不能被访问，总之不让响应包回到真正的客户端，否则会干扰测试的进行

**Comment by tonyying** [comment]
thanks！

**Comment by bulabula001** [comment]
有用，作为参考 多谢了
